### ISSUE TITLE
Panic Mode is on, but packets still appear from tcpdump

### ISSUE THREAD

**Issue by Ed-mX** [firewalld/firewalld#1449]
### What happened

When I turn Panic Mode on and then start tcpdump, it reports numerous packets.

### What you expected to happen

In Panic Mode, I expected to see no packets reported by tcpdump.

### How to reproduce it (as minimally and precisely as possible)

1. Turn on Panic Mode
2. Start tcpdump.
3. See packets being reported

### Firewalld Version

2.2.3

### Firewalld Backend

nftables

### Linux distribution

Fedora Linux 41

### Linux kernel version

6.12.9-200.fc41.x86_64

### Other information

I see:
...
21:23:39.990100 enp1s0 M   IP 192.168.1.104.33814 > 239.255.255.250.ssdp: UDP, length 340
21:23:39.990101 enp1s0 M   IP 192.168.1.104.59442 > 239.255.255.250.ssdp: UDP, length 349
21:23:39.990381 enp1s0 M   IP 192.168.1.104.58664 > 239.255.255.250.ssdp: UDP, length 392
21:23:40.050867 enp1s0 M   IP 192.168.1.104.50581 > 239.255.255.250.ssdp: UDP, length 404
21:23:40.051496 enp1s0 M   IP 192.168.1.104.53746 > 239.255.255.250.ssdp: UDP, length 406
21:23:41.991547 enp1s0 M   IP 192.168.1.104.56893 > 239.255.255.250.ssdp: UDP, length 340
21:23:41.991548 enp1s0 M   IP 192.168.1.104.59134 > 239.255.255.250.ssdp: UDP, length 349
21:23:41.991804 enp1s0 M   IP 192.168.1.104.45165 > 239.255.255.250.ssdp: UDP, length 392
21:23:42.052313 enp1s0 M   IP 192.168.1.104.41648 > 239.255.255.250.ssdp: UDP, length 404
21:23:42.053335 enp1s0 M   IP 192.168.1.104.42109 > 239.255.255.250.ssdp: UDP, length 406
21:23:47.575417 enp1s0 M   IP _gateway > 224.0.0.1: igmp query v3
21:23:52.131823 enp1s0 M   IP 192.168.1.6 > 239.255.255.250: igmp v2 report 239.255.255.250
21:24:00.485363 enp1s0 In  ARP, Request who-has fedora (04:0e:3c:28:8d:c9 (oui Unknown)) tell _gateway, length 46
21:24:00.485408 enp1s0 Out ARP, Reply fedora is-at 04:0e:3c:28:8d:c9 (oui Unknown), length 28
21:24:02.577896 enp1s0 M   IP _gateway.37621 > 239.255.255.250.ssdp: UDP, length 175

...
