### ISSUE TITLE
firewalld is blocking World of Warcraft voice even when port is open

### ISSUE THREAD

**Issue by jhu54** [firewalld/firewalld#1055]
### What happened

This issue has been reported on the Lutris forums [here](https://forums.lutris.net/t/wow-voiceerror-17/16693/39). I do not run firewalld but it seems to be with a recent update causing traffic intended for the WoW Voice service to be blocked causing an ingame error even when the user has explicitly enable the port (UDP and TCP).

### How to reproduce it (as minimally and precisely as possible)

Install battle.net launcher and World of Warcraft retail. Run WoW with the firewalld service enabled and all ports listed for WoW set to open. Games crashes with WoW Voice error 17. Disable firewalld and the game works. Use ufw with same ports open, game works.

### Other information

Happy to ask users on the Lutris forums and discord server if there is anything else you need. It is affecting the most recent update, users who have not updated do not experience this (sorry, I don't know your versions, just passing on what was told).

**Comment by Seeings** [comment]
> How to reproduce it (as minimally and precisely as possible)
> 
> Install battle.net launcher and World of Warcraft retail. Run WoW with the firewalld service enabled and all ports listed for WoW set to open. Games crashes with WoW Voice error 17. Disable firewalld and the game works. Use ufw with same ports open, game works.

To note though, is that the game doesn't crash, the game runs fine, it's just that you get error messages pretty much the entire playthrough

__

**Anything else we need to know?**
Seems to be working fine in Fedora 36 (not sure if Firewalld is different somehow in Fedora 36)

**Firewalld Version**
1.2.1-2

**Firewalld Backend**
Not sure where I get this info.

**Linux distribution**
Fedora 37

**Linux kernel version**
6.0.9-300.fc37.x86_64

**Comment by mark-russ** [comment]
**Anything else we need to know?**
Opening all ports does not seem to help either, but running `systemctl stop firewalld` works as a temporary workaround.
This issue is a little more problematic than just a simple message because connecting takes nearly an entire 60 seconds, and chat gets spammed roughly every minute with `Lost connection to the voice chat service.(VoiceError: 17)` which also causes a massive frame drop.

**Firewalld Version**
1.2.1-1

**Firewalld Backend**
iptables-nft 1:1.8.8-2

**Linux distribution**
ArchLinux

**Linux kernel version**
6.0.9.arch1-1

**Comment by sT331h0rs3** [comment]
Need to mention everything works fine with 1.0.5 in Fedora 36 or 37, but not with 1.2.1.

**Comment by corngoblin** [comment]
I have this issue in Fedora 37, but not in 36. Stopping the firewalld service seems to fix the issue in fedora 37.

**Comment by erig0** [comment]
Can someone set `--set-log-denied=all` and show `dmesg` for these dropped packets?

I would guess conntrack (kernel) is considering these voice packets as invalid. Probably triggered by commit e1d11e8691bf31d816ce556009a38bd7ebd40444.

**Comment by Seeings** [comment]
I hope this is the data you need, otherwise you will have to guide me a bit more.
Also to remove the log should i write --set-log-denied=none?

```
[55280.727987] STATE_INVALID_DROP: IN=lo OUT= MAC=00:00:00:00:00:00:00:00:00:00:00:00:86:dd SRC=0000:0000:0000:0000:0000:0000:0000:0001 DST=0000:0000:0000:0000:0000:0000:0000:0001 LEN=76 TC=0 HOPLIMIT=64 FLOWLBL=948204 PROTO=TCP SPT=59909 DPT=59909 WINDOW=512 RES=0x00 ACK PSH URGP=0 
[55282.960129] STATE_INVALID_DROP: IN=lo OUT= MAC=00:00:00:00:00:00:00:00:00:00:00:00:86:dd SRC=0000:0000:0000:0000:0000:0000:0000:0001 DST=0000:0000:0000:0000:0000:0000:0000:0001 LEN=74 TC=0 HOPLIMIT=64 FLOWLBL=948204 PROTO=TCP SPT=59909 DPT=59909 WINDOW=512 RES=0x00 ACK PSH FIN URGP=0 
[55282.966620] STATE_INVALID_DROP: IN=lo OUT= MAC=00:00:00:00:00:00:00:00:00:00:00:00:86:dd SRC=0000:0000:0000:0000:0000:0000:0000:0001 DST=0000:0000:0000:0000:0000:0000:0000:0001 LEN=72 TC=0 HOPLIMIT=64 FLOWLBL=291621 PROTO=TCP SPT=53279 DPT=53279 WINDOW=512 RES=0x00 ACK URGP=0 
[55283.167949] STATE_INVALID_DROP: IN=lo OUT= MAC=00:00:00:00:00:00:00:00:00:00:00:00:86:dd SRC=0000:0000:0000:0000:0000:0000:0000:0001 DST=0000:0000:0000:0000:0000:0000:0000:0001 LEN=75 TC=0 HOPLIMIT=64 FLOWLBL=291621 PROTO=TCP SPT=53279 DPT=53279 WINDOW=512 RES=0x00 ACK PSH URGP=0 
[55283.383946] STATE_INVALID_DROP: IN=lo OUT= MAC=00:00:00:00:00:00:00:00:00:00:00:00:86:dd SRC=0000:0000:0000:0000:0000:0000:0000:0001 DST=0000:0000:0000:0000:0000:0000:0000:0001 LEN=76 TC=0 HOPLIMIT=64 FLOWLBL=291621 PROTO=TCP SPT=53279 DPT=53279 WINDOW=512 RES=0x00 ACK PSH URGP=0 
[55283.808938] STATE_INVALID_DROP: IN=lo OUT= MAC=00:00:00:00:00:00:00:00:00:00:00:00:86:dd SRC=0000:0000:0000:0000:0000:0000:0000:0001 DST=0000:0000:0000:0000:0000:0000:0000:0001 LEN=76 TC=0 HOPLIMIT=64 FLOWLBL=291621 PROTO=TCP SPT=53279 DPT=53279 WINDOW=512 RES=0x00 ACK PSH URGP=0 
[55284.696930] STATE_INVALID_DROP: IN=lo OUT= MAC=00:00:00:00:00:00:00:00:00:00:00:00:86:dd SRC=0000:0000:0000:0000:0000:0000:0000:0001 DST=0000:0000:0000:0000:0000:0000:0000:0001 LEN=76 TC=0 HOPLIMIT=64 FLOWLBL=291621 PROTO=TCP SPT=53279 DPT=53279 WINDOW=512 RES=0x00 ACK PSH URGP=0 
[55286.423915] STATE_INVALID_DROP: IN=lo OUT= MAC=00:00:00:00:00:00:00:00:00:00:00:00:86:dd SRC=0000:0000:0000:0000:0000:0000:0000:0001 DST=0000:0000:0000:0000:0000:0000:0000:0001 LEN=76 TC=0 HOPLIMIT=64 FLOWLBL=291621 PROTO=TCP SPT=53279 DPT=53279 WINDOW=512 RES=0x00 ACK PSH URGP=0 
[55289.815865] STATE_INVALID_DROP: IN=lo OUT= MAC=00:00:00:00:00:00:00:00:00:00:00:00:86:dd SRC=0000:0000:0000:0000:0000:0000:0000:0001 DST=0000:0000:0000:0000:0000:0000:0000:0001 LEN=76 TC=0 HOPLIMIT=64 FLOWLBL=291621 PROTO=TCP SPT=53279 DPT=53279 WINDOW=512 RES=0x00 ACK PSH URGP=0 
[55294.666409] filter_IN_home_REJECT: IN=wlp0s20f3 OUT= MAC=01:00:5e:00:00:01:04:d9:f5:74:e7:c8:08:00 SRC=192.168.204.2 DST=224.0.0.1 LEN=36 TOS=0x00 PREC=0x00 TTL=1 ID=15837 DF PROTO=2 
[55296.599780] STATE_INVALID_DROP: IN=lo OUT= MAC=00:00:00:00:00:00:00:00:00:00:00:00:86:dd SRC=0000:0000:0000:0000:0000:0000:0000:0001 DST=0000:0000:0000:0000:0000:0000:0000:0001 LEN=76 TC=0 HOPLIMIT=64 FLOWLBL=291621 PROTO=TCP SPT=53279 DPT=53279 WINDOW=512 RES=0x00 ACK PSH URGP=0 
[55307.863619] STATE_INVALID_DROP: IN=lo OUT= MAC=00:00:00:00:00:00:00:00:00:00:00:00:86:dd SRC=0000:0000:0000:0000:0000:0000:0000:0001 DST=0000:0000:0000:0000:0000:0000:0000:0001 LEN=78 TC=0 HOPLIMIT=64 FLOWLBL=948204 PROTO=TCP SPT=59909 DPT=59909 WINDOW=512 RES=0x00 ACK PSH FIN URGP=0 
[55310.423585] STATE_INVALID_DROP: IN=lo OUT= MAC=00:00:00:00:00:00:00:00:00:00:00:00:86:dd SRC=0000:0000:0000:0000:0000:0000:0000:0001 DST=0000:0000:0000:0000:0000:0000:0000:0001 LEN=76 TC=0 HOPLIMIT=64 FLOWLBL=291621 PROTO=TCP SPT=53279 DPT=53279 WINDOW=512 RES=0x00 ACK PSH URGP=0 
[55312.940524] STATE_INVALID_DROP: IN=lo OUT= MAC=00:00:00:00:00:00:00:00:00:00:00:00:86:dd SRC=0000:0000:0000:0000:0000:0000:0000:0001 DST=0000:0000:0000:0000:0000:0000:0000:0001 LEN=72 TC=0 HOPLIMIT=64 FLOWLBL=920640 PROTO=TCP SPT=54349 DPT=54349 WINDOW=512 RES=0x00 ACK URGP=0 
[55312.967060] STATE_INVALID_DROP: IN=lo OUT= MAC=00:00:00:00:00:00:00:00:00:00:00:00:86:dd SRC=0000:0000:0000:0000:0000:0000:0000:0001 DST=0000:0000:0000:0000:0000:0000:0000:0001 LEN=74 TC=0 HOPLIMIT=64 FLOWLBL=291621 PROTO=TCP SPT=53279 DPT=53279 WINDOW=512 RES=0x00 ACK PSH FIN URGP=0 
[55313.144545] STATE_INVALID_DROP: IN=lo OUT= MAC=00:00:00:00:00:00:00:00:00:00:00:00:86:dd SRC=0000:0000:0000:0000:0000:0000:0000:0001 DST=0000:0000:0000:0000:0000:0000:0000:0001 LEN=75 TC=0 HOPLIMIT=64 FLOWLBL=920640 PROTO=TCP SPT=54349 DPT=54349 WINDOW=512 RES=0x00 ACK PSH URGP=0 
[55313.359549] STATE_INVALID_DROP: IN=lo OUT= MAC=00:00:00:00:00:00:00:00:00:00:00:00:86:dd SRC=0000:0000:0000:0000:0000:0000:0000:0001 DST=0000:0000:0000:0000:0000:0000:0000:0001 LEN=76 TC=0 HOPLIMIT=64 FLOWLBL=920640 PROTO=TCP SPT=54349 DPT=54349 WINDOW=512 RES=0x00 ACK PSH URGP=0 
[55313.783544] STATE_INVALID_DROP: IN=lo OUT= MAC=00:00:00:00:00:00:00:00:00:00:00:00:86:dd SRC=0000:0000:0000:0000:0000:0000:0000:0001 DST=0000:0000:0000:0000:0000:0000:0000:0001 LEN=76 TC=0 HOPLIMIT=64 FLOWLBL=920640 PROTO=TCP SPT=54349 DPT=54349 WINDOW=512 RES=0x00 ACK PSH URGP=0 
[55314.647520] STATE_INVALID_DROP: IN=lo OUT= MAC=00:00:00:00:00:00:00:00:00:00:00:00:86:dd SRC=0000:0000:0000:0000:0000:0000:0000:0001 DST=0000:0000:0000:0000:0000:0000:0000:0001 LEN=76 TC=0 HOPLIMIT=64 FLOWLBL=920640 PROTO=TCP SPT=54349 DPT=54349 WINDOW=512 RES=0x00 ACK PSH URGP=0 
[55316.375519] STATE_INVALID_DROP: IN=lo OUT= MAC=00:00:00:00:00:00:00:00:00:00:00:00:86:dd SRC=0000:0000:0000:0000:0000:0000:0000:0001 DST=0000:0000:0000:0000:0000:0000:0000:0001 LEN=76 TC=0 HOPLIMIT=64 FLOWLBL=920640 PROTO=TCP SPT=54349 DPT=54349 WINDOW=512 RES=0x00 ACK PSH URGP=0 
[55319.767457] STATE_INVALID_DROP: IN=lo OUT= MAC=00:00:00:00:00:00:00:00:00:00:00:00:86:dd SRC=0000:0000:0000:0000:0000:0000:0000:0001 DST=0000:0000:0000:0000:0000:0000:0000:0001 LEN=76 TC=0 HOPLIMIT=64 FLOWLBL=920640 PROTO=TCP SPT=54349 DPT=54349 WINDOW=512 RES=0x00 ACK PSH URGP=0 
[55326.807360] STATE_INVALID_DROP: IN=lo OUT= MAC=00:00:00:00:00:00:00:00:00:00:00:00:86:dd SRC=0000:0000:0000:0000:0000:0000:0000:0001 DST=0000:0000:0000:0000:0000:0000:0000:0001 LEN=76 TC=0 HOPLIMIT=64 FLOWLBL=920640 PROTO=TCP SPT=54349 DPT=54349 WINDOW=512 RES=0x00 ACK PSH URGP=0 
[55337.559228] STATE_INVALID_DROP: IN=lo OUT= MAC=00:00:00:00:00:00:00:00:00:00:00:00:86:dd SRC=0000:0000:0000:0000:0000:0000:0000:0001 DST=0000:0000:0000:0000:0000:0000:0000:0001 LEN=78 TC=0 HOPLIMIT=64 FLOWLBL=291621 PROTO=TCP SPT=53279 DPT=53279 WINDOW=512 RES=0x00 ACK PSH FIN URGP=0 
[55340.632168] STATE_INVALID_DROP: IN=lo OUT= MAC=00:00:00:00:00:00:00:00:00:00:00:00:86:dd SRC=0000:0000:0000:0000:0000:0000:0000:0001 DST=0000:0000:0000:0000:0000:0000:0000:0001 LEN=76 TC=0 HOPLIMIT=64 FLOWLBL=920640 PROTO=TCP SPT=54349 DPT=54349 WINDOW=512 RES=0x00 ACK PSH URGP=0 
[55342.940713] STATE_INVALID_DROP: IN=lo OUT= MAC=00:00:00:00:00:00:00:00:00:00:00:00:86:dd SRC=0000:0000:0000:0000:0000:0000:0000:0001 DST=0000:0000:0000:0000:0000:0000:0000:0001 LEN=74 TC=0 HOPLIMIT=64 FLOWLBL=920640 PROTO=TCP SPT=54349 DPT=54349 WINDOW=512 RES=0x00 ACK PSH FIN URGP=0 

```

I believe it's the same as the person who replied to my post on the WoW forums have:
https://eu.forums.blizzard.com/en/wow/t/voiceerror-17-linux/404426/2

**Comment by erig0** [comment]
> I hope this is the data you need, otherwise you will have to guide me a bit more. Also to remove the log should i write --set-log-denied=none?

Use `--set-log-denied=off` to disable it.

**Comment by erig0** [comment]
Hrm, those ports are in the ephemeral range and TCP. I expected `3478-3479` UDP. Are you certain those are note related to something else?

**Comment by Seeings** [comment]
Found some UDP ports as well not sure if those are related to this or another connection though.
```
[58558.598796] filter_IN_home_REJECT: IN=wlp0s20f3 OUT= MAC= SRC=192.168.204.3 DST=224.0.0.252 LEN=50 TOS=0x00 PREC=0x00 TTL=255 ID=7942 PROTO=UDP SPT=5355 DPT=5355 LEN=30 
[58559.672107] filter_IN_home_REJECT: IN=wlp0s20f3 OUT= MAC= SRC=192.168.204.3 DST=224.0.0.252 LEN=50 TOS=0x00 PREC=0x00 TTL=255 ID=8356 PROTO=UDP SPT=5355 DPT=5355 LEN=30 
[58560.680051] filter_IN_home_REJECT: IN=wlp0s20f3 OUT= MAC= SRC=192.168.204.3 DST=224.0.0.252 LEN=50 TOS=0x00 PREC=0x00 TTL=255 ID=8378 PROTO=UDP SPT=5355 DPT=5355 LEN=30 
[58567.643937] filter_IN_home_REJECT: IN=wlp0s20f3 OUT= MAC= SRC=192.168.204.3 DST=224.0.0.252 LEN=50 TOS=0x00 PREC=0x00 TTL=255 ID=8992 PROTO=UDP SPT=5355 DPT=5355 LEN=30 
[58568.695689] filter_IN_home_REJECT: IN=wlp0s20f3 OUT= MAC= SRC=192.168.204.3 DST=224.0.0.252 LEN=50 TOS=0x00 PREC=0x00 TTL=255 ID=9790 PROTO=UDP SPT=5355 DPT=5355 LEN=30 
[58569.945678] filter_IN_home_REJECT: IN=wlp0s20f3 OUT= MAC= SRC=192.168.204.3 DST=224.0.0.252 LEN=50 TOS=0x00 PREC=0x00 TTL=255 ID=10677 PROTO=UDP SPT=5355 DPT=5355 LEN=30 
```

Not that great at this stuff, so I'm trying with what I can see :)

**Comment by Seeings** [comment]
Here are some more that I think are related they seem to be showing up at the time it tries to connect

```
[59375.195694] filter_IN_home_REJECT: IN=wlp0s20f3 OUT= MAC=ff:ff:ff:ff:ff:ff:04:d9:f5:74:e7:c8:08:00 SRC=192.168.204.2 DST=255.255.255.255 LEN=540 TOS=0x00 PREC=0x00 TTL=64 ID=42913 DF PROTO=UDP SPT=9999 DPT=9999 LEN=520 
[59375.195699] filter_IN_home_REJECT: IN=wlp0s20f3 OUT= MAC=ff:ff:ff:ff:ff:ff:04:d9:f5:74:e7:c8:08:00 SRC=192.168.204.2 DST=255.255.255.255 LEN=540 TOS=0x00 PREC=0x00 TTL=64 ID=42913 DF PROTO=UDP SPT=9999 DPT=9999 LEN=520 
[59375.195701] filter_IN_home_REJECT: IN=wlp0s20f3 OUT= MAC=ff:ff:ff:ff:ff:ff:04:d9:f5:74:e7:c8:08:00 SRC=192.168.204.2 DST=255.255.255.255 LEN=540 TOS=0x00 PREC=0x00 TTL=64 ID=42912 DF PROTO=UDP SPT=9999 DPT=9999 LEN=520 
[59375.195703] filter_IN_home_REJECT: IN=wlp0s20f3 OUT= MAC=ff:ff:ff:ff:ff:ff:04:d9:f5:74:e7:c8:08:00 SRC=192.168.204.2 DST=255.255.255.255 LEN=540 TOS=0x00 PREC=0x00 TTL=64 ID=42912 DF PROTO=UDP SPT=9999 DPT=9999 LEN=520 
[59376.729426] filter_IN_home_REJECT: IN=wlp0s20f3 OUT= MAC=ff:ff:ff:ff:ff:ff:04:d9:f5:74:e7:c8:08:00 SRC=192.168.204.2 DST=255.255.255.255 LEN=540 TOS=0x00 PREC=0x00 TTL=64 ID=43065 DF PROTO=UDP SPT=9999 DPT=9999 LEN=520 
[59376.833527] filter_IN_home_REJECT: IN=wlp0s20f3 OUT= MAC=ff:ff:ff:ff:ff:ff:04:d9:f5:74:e7:c8:08:00 SRC=192.168.204.2 DST=255.255.255.255 LEN=540 TOS=0x00 PREC=0x00 TTL=64 ID=43065 DF PROTO=UDP SPT=9999 DPT=9999 LEN=520 
[59376.833532] filter_IN_home_REJECT: IN=wlp0s20f3 OUT= MAC=ff:ff:ff:ff:ff:ff:04:d9:f5:74:e7:c8:08:00 SRC=192.168.204.2 DST=255.255.255.255 LEN=540 TOS=0x00 PREC=0x00 TTL=64 ID=43066 DF PROTO=UDP SPT=9999 DPT=9999 LEN=520 
[59376.833534] filter_IN_home_REJECT: IN=wlp0s20f3 OUT= MAC=ff:ff:ff:ff:ff:ff:04:d9:f5:74:e7:c8:08:00 SRC=192.168.204.2 DST=255.255.255.255 LEN=540 TOS=0x00 PREC=0x00 TTL=64 ID=43066 DF PROTO=UDP SPT=9999 DPT=9999 LEN=520 
```

This seems to be each time I get the "Lost connection to the voice chat service. (Voice Error: 17)" message, while the UDP seems to be the actual tries.
```
[59479.638448] filter_IN_home_REJECT: IN=wlp0s20f3 OUT= MAC=01:00:5e:00:00:01:04:d9:f5:74:e7:c8:08:00 SRC=192.168.204.2 DST=224.0.0.1 LEN=36 TOS=0x00 PREC=0x00 TTL=1 ID=32389 DF PROTO=2 
[59479.641178] filter_IN_home_REJECT: IN=wlp0s20f3 OUT= MAC=01:00:5e:00:00:01:04:d9:f5:74:e7:c8:08:00 SRC=192.168.204.2 DST=224.0.0.1 LEN=36 TOS=0x00 PREC=0x00 TTL=1 ID=32389 DF PROTO=2 
```

```
[59673.835574] STATE_INVALID_DROP: IN=lo OUT= MAC=00:00:00:00:00:00:00:00:00:00:00:00:86:dd SRC=0000:0000:0000:0000:0000:0000:0000:0001 DST=0000:0000:0000:0000:0000:0000:0000:0001 LEN=72 TC=0 HOPLIMIT=64 FLOWLBL=628101 PROTO=TCP SPT=43751 DPT=43751 WINDOW=512 RES=0x00 ACK URGP=0 
[59673.840460] STATE_INVALID_DROP: IN=lo OUT= MAC=00:00:00:00:00:00:00:00:00:00:00:00:86:dd SRC=0000:0000:0000:0000:0000:0000:0000:0001 DST=0000:0000:0000:0000:0000:0000:0000:0001 LEN=74 TC=0 HOPLIMIT=64 FLOWLBL=135348 PROTO=TCP SPT=41915 DPT=41915 WINDOW=512 RES=0x00 ACK PSH FIN URGP=0 
[59674.039950] STATE_INVALID_DROP: IN=lo OUT= MAC=00:00:00:00:00:00:00:00:00:00:00:00:86:dd SRC=0000:0000:0000:0000:0000:0000:0000:0001 DST=0000:0000:0000:0000:0000:0000:0000:0001 LEN=75 TC=0 HOPLIMIT=64 FLOWLBL=628101 PROTO=TCP SPT=43751 DPT=43751 WINDOW=512 RES=0x00 ACK PSH URGP=0 
[59674.714882] filter_IN_home_REJECT: IN=wlp0s20f3 OUT= MAC=ff:ff:ff:ff:ff:ff:04:d9:f5:74:e7:c8:08:00 SRC=192.168.204.2 DST=255.255.255.255 LEN=540 TOS=0x00 PREC=0x00 TTL=64 ID=63257 DF PROTO=UDP SPT=9999 DPT=9999 LEN=520 
[59674.714887] filter_IN_home_REJECT: IN=wlp0s20f3 OUT= MAC=ff:ff:ff:ff:ff:ff:04:d9:f5:74:e7:c8:08:00 SRC=192.168.204.2 DST=255.255.255.255 LEN=540 TOS=0x00 PREC=0x00 TTL=64 ID=63257 DF PROTO=UDP SPT=9999 DPT=9999 LEN=520 
[59674.714889] filter_IN_home_REJECT: IN=wlp0s20f3 OUT= MAC=ff:ff:ff:ff:ff:ff:04:d9:f5:74:e7:c8:08:00 SRC=192.168.204.2 DST=255.255.255.255 LEN=540 TOS=0x00 PREC=0x00 TTL=64 ID=63258 DF PROTO=UDP SPT=9999 DPT=9999 LEN=520 
[59674.714890] filter_IN_home_REJECT: IN=wlp0s20f3 OUT= MAC=ff:ff:ff:ff:ff:ff:04:d9:f5:74:e7:c8:08:00 SRC=192.168.204.2 DST=255.255.255.255 LEN=540 TOS=0x00 PREC=0x00 TTL=64 ID=63258 DF PROTO=UDP SPT=9999 DPT=9999 LEN=520 
[59676.250896] filter_IN_home_REJECT: IN=wlp0s20f3 OUT= MAC=ff:ff:ff:ff:ff:ff:04:d9:f5:74:e7:c8:08:00 SRC=192.168.204.2 DST=255.255.255.255 LEN=540 TOS=0x00 PREC=0x00 TTL=64 ID=63337 DF PROTO=UDP SPT=9999 DPT=9999 LEN=520 
[59676.250906] filter_IN_home_REJECT: IN=wlp0s20f3 OUT= MAC=ff:ff:ff:ff:ff:ff:04:d9:f5:74:e7:c8:08:00 SRC=192.168.204.2 DST=255.255.255.255 LEN=540 TOS=0x00 PREC=0x00 TTL=64 ID=63337 DF PROTO=UDP SPT=9999 DPT=9999 LEN=520 
[59676.250908] filter_IN_home_REJECT: IN=wlp0s20f3 OUT= MAC=ff:ff:ff:ff:ff:ff:04:d9:f5:74:e7:c8:08:00 SRC=192.168.204.2 DST=255.255.255.255 LEN=540 TOS=0x00 PREC=0x00 TTL=64 ID=63336 DF PROTO=UDP SPT=9999 DPT=9999 LEN=520 
[59676.250910] filter_IN_home_REJECT: IN=wlp0s20f3 OUT= MAC=ff:ff:ff:ff:ff:ff:04:d9:f5:74:e7:c8:08:00 SRC=192.168.204.2 DST=255.255.255.255 LEN=540 TOS=0x00 PREC=0x00 TTL=64 ID=63336 DF PROTO=UDP SPT=9999 DPT=9999 LEN=520 
[59677.784902] filter_IN_home_REJECT: IN=wlp0s20f3 OUT= MAC=ff:ff:ff:ff:ff:ff:04:d9:f5:74:e7:c8:08:00 SRC=192.168.204.2 DST=255.255.255.255 LEN=540 TOS=0x00 PREC=0x00 TTL=64 ID=63476 DF PROTO=UDP SPT=9999 DPT=9999 LEN=520 
[59678.093200] filter_IN_home_REJECT: IN=wlp0s20f3 OUT= MAC=ff:ff:ff:ff:ff:ff:04:d9:f5:74:e7:c8:08:00 SRC=192.168.204.2 DST=255.255.255.255 LEN=540 TOS=0x00 PREC=0x00 TTL=64 ID=63476 DF PROTO=UDP SPT=9999 DPT=9999 LEN=520 
[59678.093205] filter_IN_home_REJECT: IN=wlp0s20f3 OUT= MAC=ff:ff:ff:ff:ff:ff:04:d9:f5:74:e7:c8:08:00 SRC=192.168.204.2 DST=255.255.255.255 LEN=540 TOS=0x00 PREC=0x00 TTL=64 ID=63477 DF PROTO=UDP SPT=9999 DPT=9999 LEN=520 
[59678.093207] filter_IN_home_REJECT: IN=wlp0s20f3 OUT= MAC=ff:ff:ff:ff:ff:ff:04:d9:f5:74:e7:c8:08:00 SRC=192.168.204.2 DST=255.255.255.255 LEN=540 TOS=0x00 PREC=0x00 TTL=64 ID=63477 DF PROTO=UDP SPT=9999 DPT=9999 LEN=520 
[59695.662740] STATE_INVALID_DROP: IN=lo OUT= MAC=00:00:00:00:00:00:00:00:00:00:00:00:86:dd SRC=0000:0000:0000:0000:0000:0000:0000:0001 DST=0000:0000:0000:0000:0000:0000:0000:0001 LEN=78 TC=0 HOPLIMIT=64 FLOWLBL=979378 PROTO=TCP SPT=60839 DPT=60839 WINDOW=512 RES=0x00 ACK PSH FIN URGP=0 
[59700.270694] STATE_INVALID_DROP: IN=lo OUT= MAC=00:00:00:00:00:00:00:00:00:00:00:00:86:dd SRC=0000:0000:0000:0000:0000:0000:0000:0001 DST=0000:0000:0000:0000:0000:0000:0000:0001 LEN=76 TC=0 HOPLIMIT=64 FLOWLBL=628101 PROTO=TCP SPT=43751 DPT=43751 WINDOW=512 RES=0x00 ACK PSH URGP=0 
[59703.814802] STATE_INVALID_DROP: IN=lo OUT= MAC=00:00:00:00:00:00:00:00:00:00:00:00:86:dd SRC=0000:0000:0000:0000:0000:0000:0000:0001 DST=0000:0000:0000:0000:0000:0000:0000:0001 LEN=72 TC=0 HOPLIMIT=64 FLOWLBL=563609 PROTO=TCP SPT=53145 DPT=53145 WINDOW=512 RES=0x00 ACK URGP=0 
[59703.836425] STATE_INVALID_DROP: IN=lo OUT= MAC=00:00:00:00:00:00:00:00:00:00:00:00:86:dd SRC=0000:0000:0000:0000:0000:0000:0000:0001 DST=0000:0000:0000:0000:0000:0000:0000:0001 LEN=74 TC=0 HOPLIMIT=64 FLOWLBL=628101 PROTO=TCP SPT=43751 DPT=43751 WINDOW=512 RES=0x00 ACK PSH FIN URGP=0 
[59704.022652] STATE_INVALID_DROP: IN=lo OUT= MAC=00:00:00:00:00:00:00:00:00:00:00:00:86:dd SRC=0000:0000:0000:0000:0000:0000:0000:0001 DST=0000:0000:0000:0000:0000:0000:0000:0001 LEN=75 TC=0 HOPLIMIT=64 FLOWLBL=563609 PROTO=TCP SPT=53145 DPT=53145 WINDOW=512 RES=0x00 ACK PSH URGP=0 
[59724.335454] STATE_INVALID_DROP: IN=lo OUT= MAC=00:00:00:00:00:00:00:00:00:00:00:00:86:dd SRC=0000:0000:0000:0000:0000:0000:0000:0001 DST=0000:0000:0000:0000:0000:0000:0000:0001 LEN=78 TC=0 HOPLIMIT=64 FLOWLBL=135348 PROTO=TCP SPT=41915 DPT=41915 WINDOW=512 RES=0x00 ACK PSH FIN URGP=0 
[59730.478398] STATE_INVALID_DROP: IN=lo OUT= MAC=00:00:00:00:00:00:00:00:00:00:00:00:86:dd SRC=0000:0000:0000:0000:0000:0000:0000:0001 DST=0000:0000:0000:0000:0000:0000:0000:0001 LEN=76 TC=0 HOPLIMIT=64 FLOWLBL=563609 PROTO=TCP SPT=53145 DPT=53145 WINDOW=512 RES=0x00 ACK PSH URGP=0 
[59733.815040] STATE_INVALID_DROP: IN=lo OUT= MAC=00:00:00:00:00:00:00:00:00:00:00:00:86:dd SRC=0000:0000:0000:0000:0000:0000:0000:0001 DST=0000:0000:0000:0000:0000:0000:0000:0001 LEN=74 TC=0 HOPLIMIT=64 FLOWLBL=563609 PROTO=TCP SPT=53145 DPT=53145 WINDOW=512 RES=0x00 ACK PSH FIN URGP=0 
[59733.834140] STATE_INVALID_DROP: IN=lo OUT= MAC=00:00:00:00:00:00:00:00:00:00:00:00:86:dd SRC=0000:0000:0000:0000:0000:0000:0000:0001 DST=0000:0000:0000:0000:0000:0000:0000:0001 LEN=72 TC=0 HOPLIMIT=64 FLOWLBL=813306 PROTO=TCP SPT=55791 DPT=55791 WINDOW=512 RES=0x00 ACK URGP=0 
[59734.038361] STATE_INVALID_DROP: IN=lo OUT= MAC=00:00:00:00:00:00:00:00:00:00:00:00:86:dd SRC=0000:0000:0000:0000:0000:0000:0000:0001 DST=0000:0000:0000:0000:0000:0000:0000:0001 LEN=75 TC=0 HOPLIMIT=64 FLOWLBL=813306 PROTO=TCP SPT=55791 DPT=55791 WINDOW=512 RES=0x00 ACK PSH URGP=0 
[59739.838306] filter_IN_home_REJECT: IN=wlp0s20f3 OUT= MAC=01:00:5e:00:00:01:04:d9:f5:74:e7:c8:08:00 SRC=192.168.204.2 DST=224.0.0.1 LEN=36 TOS=0x00 PREC=0x00 TTL=1 ID=40571 DF PROTO=2 
[59740.145424] filter_IN_home_REJECT: IN=wlp0s20f3 OUT= MAC=01:00:5e:00:00:01:04:d9:f5:74:e7:c8:08:00 SRC=192.168.204.2 DST=224.0.0.1 LEN=36 TOS=0x00 PREC=0x00 TTL=1 ID=40571 DF PROTO=2 
[59753.006179] STATE_INVALID_DROP: IN=lo OUT= MAC=00:00:00:00:00:00:00:00:00:00:00:00:86:dd SRC=0000:0000:0000:0000:0000:0000:0000:0001 DST=0000:0000:0000:0000:0000:0000:0000:0001 LEN=78 TC=0 HOPLIMIT=64 FLOWLBL=628101 PROTO=TCP SPT=43751 DPT=43751 WINDOW=512 RES=0x00 ACK PSH FIN URGP=0 
[59759.806268] filter_IN_home_REJECT: IN=wlp0s20f3 OUT= MAC=01:00:5e:00:00:01:04:d9:f5:74:e7:c8:08:00 SRC=192.168.204.2 DST=224.0.0.1 LEN=36 TOS=0x00 PREC=0x00 TTL=1 ID=40956 DF PROTO=2 
[59760.174107] STATE_INVALID_DROP: IN=lo OUT= MAC=00:00:00:00:00:00:00:00:00:00:00:00:86:dd SRC=0000:0000:0000:0000:0000:0000:0000:0001 DST=0000:0000:0000:0000:0000:0000:0000:0001 LEN=76 TC=0 HOPLIMIT=64 FLOWLBL=813306 PROTO=TCP SPT=55791 DPT=55791 WINDOW=512 RES=0x00 ACK PSH URGP=0 
```

**Comment by erig0** [comment]
Hrm, the only thing notable that I see in your logs is the lines with `STATE_INVALID_DROP:`. These are TCP ACKs. It's odd that conntrack thinks these are invalid. Perhaps the proxy is doing something weird such that conntrack doesn't see the full connection, e.g. TCP SYN.

Can someone try adding another rule to allow `lo` traffic _before_ the conntrack state checks? This should verify what I said above.

```
# nft add rule inet firewalld filter_INPUT index 1 iifname "lo" accept
```

**Comment by cody35367** [comment]
> Hrm, the only thing notable that I see in your logs is the lines with `STATE_INVALID_DROP:`. These are TCP ACKs. It's odd that conntrack thinks these are invalid. Perhaps the proxy is doing something weird such that conntrack doesn't see the full connection, e.g. TCP SYN.
> 
> Can someone try adding another rule to allow `lo` traffic _before_ the conntrack state checks? This should verify what I said above.
> 
> ```
> # nft add rule inet firewalld filter_INPUT index 1 iifname "lo" accept
> ```

This works for me. No initial connection delays and no voice chat connection issues in game.

Current state:
```
$ sudo nft list chain inet firewalld filter_INPUT
table inet firewalld {
	chain filter_INPUT {
		type filter hook input priority filter + 10; policy accept;
		ct state { established, related } accept
		ct status dnat accept
		iifname "lo" accept
		ct state invalid drop
		iifname "lo" accept
		jump filter_INPUT_ZONES
		reject with icmpx admin-prohibited
	}
}
$ sudo firewall-cmd --state 
running
```

The nft add added the `iifname "lo" accept` above the `ct state invalid drop`

**Comment by mark-russ** [comment]
> Hrm, the only thing notable that I see in your logs is the lines with `STATE_INVALID_DROP:`. These are TCP ACKs. It's odd that conntrack thinks these are invalid. Perhaps the proxy is doing something weird such that conntrack doesn't see the full connection, e.g. TCP SYN.
> 
> Can someone try adding another rule to allow `lo` traffic _before_ the conntrack state checks? This should verify what I said above.
> 
> ```
> # nft add rule inet firewalld filter_INPUT index 1 iifname "lo" accept
> ```

That also fixed it for me.

**Comment by erig0** [comment]
Another workaround is to flag these TCP packets as `notrack`. This could be done in iptables or nftables out of band of firewalld.

**Comment by cody35367** [comment]
Not sure about docs. However here is a quick wireshark (filtering just by ::1 on lo) of a successful quick connect with the workaround in place. Not sure if this helps.
[wow-connecting-success.zip](https://github.com/firewalld/firewalld/files/10124278/wow-connecting-success.zip)

**Comment by erig0** [comment]
Looking at the pcap...

```
09:39:31.073321 IP6 (flowlabel 0x7be62, hlim 64, next-header TCP (6) payload length: 40) localhost.60291 > localhost.60291: Flags [S], cksum 0x0030 (incorrect -> 0xae4c), seq 3329998095, win 65476, options [mss 65476,sackOK,TS val 3387587422 ecr 0,nop,wscale 7], length 0
09:39:31.073335 IP6 (flowlabel 0x7be62, hlim 64, next-header TCP (6) payload length: 40) localhost.60291 > localhost.60291: Flags [S.], cksum 0x0030 (incorrect -> 0xe566), seq 3329998095, ack 3329998096, win 65476, options [mss 65476,sackOK,TS val 3387587422 ecr 3387587422,nop,wscale 7], length 0
09:39:31.073341 IP6 (flowlabel 0x7be62, hlim 64, next-header TCP (6) payload length: 32) localhost.60291 > localhost.60291: Flags [.], cksum 0x0028 (incorrect -> 0x0c09), ack 1, win 512, options [nop,nop,TS val 3387587422 ecr 3387587422], length 0
```

We see a SYN, then SYN/ACK, then ACK. This is normal and expected start of a TCP session.

Can you collect an example _without_ the workaround?

**Comment by cody35367** [comment]
Here is an example without the workaround.

[wow-connecting-no-workaround-slow.zip](https://github.com/firewalld/firewalld/files/10129031/wow-connecting-no-workaround-slow.zip)

**Comment by erig0** [comment]
@cody35367 , lastly can you show `conntrack -L` immediately after you attempt to connect (no workaround). This will dump the connection tracing table.

**Comment by cody35367** [comment]
With no workaround, about 10 seconds into the "Connecting..." dialog:
```
$ sudo conntrack -L
tcp      6 95 TIME_WAIT src=127.0.0.1 dst=127.0.0.1 sport=37234 dport=6881 src=127.0.0.1 dst=127.0.0.1 sport=6881 dport=37234 [ASSURED] mark=0 secctx=system_u:object_r:unlabeled_t:s0 use=1
tcp      6 105 TIME_WAIT src=127.0.0.1 dst=127.0.0.1 sport=54758 dport=6881 src=127.0.0.1 dst=127.0.0.1 sport=6881 dport=54758 [ASSURED] mark=0 secctx=system_u:object_r:unlabeled_t:s0 use=1
tcp      6 64 TIME_WAIT src=127.0.0.1 dst=127.0.0.1 sport=42078 dport=6881 src=127.0.0.1 dst=127.0.0.1 sport=6881 dport=42078 [ASSURED] mark=0 secctx=system_u:object_r:unlabeled_t:s0 use=1
tcp      6 65 TIME_WAIT src=127.0.0.1 dst=127.0.0.1 sport=42248 dport=6881 src=127.0.0.1 dst=127.0.0.1 sport=6881 dport=42248 [ASSURED] mark=0 secctx=system_u:object_r:unlabeled_t:s0 use=1
tcp      6 431994 ESTABLISHED src=10.0.125.114 dst=24.105.29.76 sport=36492 dport=443 src=24.105.29.76 dst=10.0.125.114 sport=443 dport=36492 [ASSURED] mark=0 secctx=system_u:object_r:unlabeled_t:s0 use=1
udp      17 15 src=10.0.125.114 dst=10.0.125.1 sport=57963 dport=53 src=10.0.125.1 dst=10.0.125.114 sport=53 dport=57963 mark=0 secctx=system_u:object_r:unlabeled_t:s0 use=1
tcp      6 431997 ESTABLISHED src=10.0.125.114 dst=44.225.114.15 sport=55936 dport=443 src=44.225.114.15 dst=10.0.125.114 sport=443 dport=55936 [ASSURED] mark=0 secctx=system_u:object_r:unlabeled_t:s0 use=1
tcp      6 63 TIME_WAIT src=127.0.0.1 dst=127.0.0.1 sport=42010 dport=6881 src=127.0.0.1 dst=127.0.0.1 sport=6881 dport=42010 [ASSURED] mark=0 secctx=system_u:object_r:unlabeled_t:s0 use=1
tcp      6 104 TIME_WAIT src=127.0.0.1 dst=127.0.0.1 sport=44276 dport=42273 src=127.0.0.1 dst=127.0.0.1 sport=42273 dport=44276 [ASSURED] mark=0 secctx=system_u:object_r:unlabeled_t:s0 use=1
tcp      6 66 TIME_WAIT src=127.0.0.1 dst=127.0.0.1 sport=42286 dport=6881 src=127.0.0.1 dst=127.0.0.1 sport=6881 dport=42286 [ASSURED] mark=0 secctx=system_u:object_r:unlabeled_t:s0 use=1
tcp      6 65 TIME_WAIT src=127.0.0.1 dst=127.0.0.1 sport=42166 dport=6881 src=127.0.0.1 dst=127.0.0.1 sport=6881 dport=42166 [ASSURED] mark=0 secctx=system_u:object_r:unlabeled_t:s0 use=1
tcp      6 63 TIME_WAIT src=10.0.125.114 dst=137.221.106.19 sport=36268 dport=1119 src=137.221.106.19 dst=10.0.125.114 sport=1119 dport=36268 [ASSURED] mark=0 secctx=system_u:object_r:unlabeled_t:s0 use=1
tcp      6 431976 ESTABLISHED src=127.0.0.1 dst=127.0.0.1 sport=55972 dport=37033 src=127.0.0.1 dst=127.0.0.1 sport=37033 dport=55972 [ASSURED] mark=0 secctx=system_u:object_r:unlabeled_t:s0 use=1
tcp      6 64 TIME_WAIT src=10.0.125.114 dst=137.221.106.22 sport=47244 dport=1119 src=137.221.106.22 dst=10.0.125.114 sport=1119 dport=47244 [ASSURED] mark=0 secctx=system_u:object_r:unlabeled_t:s0 use=1
tcp      6 431986 ESTABLISHED src=127.0.0.1 dst=127.0.0.1 sport=51176 dport=35889 src=127.0.0.1 dst=127.0.0.1 sport=35889 dport=51176 [ASSURED] mark=0 secctx=system_u:object_r:unlabeled_t:s0 use=2
tcp      6 64 TIME_WAIT src=127.0.0.1 dst=127.0.0.1 sport=42068 dport=6881 src=127.0.0.1 dst=127.0.0.1 sport=6881 dport=42068 [ASSURED] mark=0 secctx=system_u:object_r:unlabeled_t:s0 use=1
tcp      6 63 TIME_WAIT src=10.0.125.114 dst=137.221.106.19 sport=36260 dport=1119 src=137.221.106.19 dst=10.0.125.114 sport=1119 dport=36260 [ASSURED] mark=0 secctx=system_u:object_r:unlabeled_t:s0 use=1
tcp      6 63 TIME_WAIT src=10.0.125.114 dst=137.221.106.22 sport=47210 dport=1119 src=137.221.106.22 dst=10.0.125.114 sport=1119 dport=47210 [ASSURED] mark=0 secctx=system_u:object_r:unlabeled_t:s0 use=1
tcp      6 65 TIME_WAIT src=127.0.0.1 dst=127.0.0.1 sport=42232 dport=6881 src=127.0.0.1 dst=127.0.0.1 sport=6881 dport=42232 [ASSURED] mark=0 secctx=system_u:object_r:unlabeled_t:s0 use=1
tcp      6 431975 ESTABLISHED src=10.0.125.114 dst=24.105.29.76 sport=48270 dport=443 src=24.105.29.76 dst=10.0.125.114 sport=443 dport=48270 [ASSURED] mark=0 secctx=system_u:object_r:unlabeled_t:s0 use=1
tcp      6 111 TIME_WAIT src=127.0.0.1 dst=127.0.0.1 sport=38516 dport=6881 src=127.0.0.1 dst=127.0.0.1 sport=6881 dport=38516 [ASSURED] mark=0 secctx=system_u:object_r:unlabeled_t:s0 use=1
tcp      6 64 TIME_WAIT src=10.0.125.114 dst=137.221.106.19 sport=36282 dport=1119 src=137.221.106.19 dst=10.0.125.114 sport=1119 dport=36282 [ASSURED] mark=0 secctx=system_u:object_r:unlabeled_t:s0 use=1
tcp      6 66 TIME_WAIT src=127.0.0.1 dst=127.0.0.1 sport=52572 dport=33165 src=127.0.0.1 dst=127.0.0.1 sport=33165 dport=52572 [ASSURED] mark=0 secctx=system_u:object_r:unlabeled_t:s0 use=1
tcp      6 64 TIME_WAIT src=127.0.0.1 dst=127.0.0.1 sport=42080 dport=6881 src=127.0.0.1 dst=127.0.0.1 sport=6881 dport=42080 [ASSURED] mark=0 secctx=system_u:object_r:unlabeled_t:s0 use=1
tcp      6 64 TIME_WAIT src=127.0.0.1 dst=127.0.0.1 sport=42102 dport=6881 src=127.0.0.1 dst=127.0.0.1 sport=6881 dport=42102 [ASSURED] mark=0 secctx=system_u:object_r:unlabeled_t:s0 use=1
tcp      6 66 TIME_WAIT src=127.0.0.1 dst=127.0.0.1 sport=42300 dport=6881 src=127.0.0.1 dst=127.0.0.1 sport=6881 dport=42300 [ASSURED] mark=0 secctx=system_u:object_r:unlabeled_t:s0 use=1
tcp      6 64 TIME_WAIT src=10.0.125.114 dst=137.221.106.19 sport=36300 dport=1119 src=137.221.106.19 dst=10.0.125.114 sport=1119 dport=36300 [ASSURED] mark=0 secctx=system_u:object_r:unlabeled_t:s0 use=1
tcp      6 64 TIME_WAIT src=127.0.0.1 dst=127.0.0.1 sport=42088 dport=6881 src=127.0.0.1 dst=127.0.0.1 sport=6881 dport=42088 [ASSURED] mark=0 secctx=system_u:object_r:unlabeled_t:s0 use=1
tcp      6 106 TIME_WAIT src=127.0.0.1 dst=127.0.0.1 sport=54778 dport=6881 src=127.0.0.1 dst=127.0.0.1 sport=6881 dport=54778 [ASSURED] mark=0 secctx=system_u:object_r:unlabeled_t:s0 use=1
tcp      6 65 TIME_WAIT src=127.0.0.1 dst=127.0.0.1 sport=42200 dport=6881 src=127.0.0.1 dst=127.0.0.1 sport=6881 dport=42200 [ASSURED] mark=0 secctx=system_u:object_r:unlabeled_t:s0 use=1
udp      17 14 src=10.0.125.114 dst=10.0.125.1 sport=44627 dport=53 src=10.0.125.1 dst=10.0.125.114 sport=53 dport=44627 mark=0 secctx=system_u:object_r:unlabeled_t:s0 use=1
tcp      6 64 TIME_WAIT src=10.0.125.114 dst=137.221.106.19 sport=36292 dport=1119 src=137.221.106.19 dst=10.0.125.114 sport=1119 dport=36292 [ASSURED] mark=0 secctx=system_u:object_r:unlabeled_t:s0 use=1
tcp      6 67 TIME_WAIT src=10.0.125.114 dst=137.221.106.121 sport=56448 dport=443 src=137.221.106.121 dst=10.0.125.114 sport=443 dport=56448 [ASSURED] mark=0 secctx=system_u:object_r:unlabeled_t:s0 use=1
tcp      6 95 TIME_WAIT src=10.0.125.114 dst=104.117.244.50 sport=48536 dport=443 src=104.117.244.50 dst=10.0.125.114 sport=443 dport=48536 [ASSURED] mark=0 secctx=system_u:object_r:unlabeled_t:s0 use=1
tcp      6 64 TIME_WAIT src=127.0.0.1 dst=127.0.0.1 sport=42030 dport=6881 src=127.0.0.1 dst=127.0.0.1 sport=6881 dport=42030 [ASSURED] mark=0 secctx=system_u:object_r:unlabeled_t:s0 use=1
tcp      6 65 TIME_WAIT src=127.0.0.1 dst=127.0.0.1 sport=42218 dport=6881 src=127.0.0.1 dst=127.0.0.1 sport=6881 dport=42218 [ASSURED] mark=0 secctx=system_u:object_r:unlabeled_t:s0 use=1
tcp      6 99 TIME_WAIT src=127.0.0.1 dst=127.0.0.1 sport=50864 dport=46167 src=127.0.0.1 dst=127.0.0.1 sport=46167 dport=50864 [ASSURED] mark=0 secctx=system_u:object_r:unlabeled_t:s0 use=1
tcp      6 431985 ESTABLISHED src=127.0.0.1 dst=127.0.0.1 sport=44236 dport=39063 src=127.0.0.1 dst=127.0.0.1 sport=39063 dport=44236 [ASSURED] mark=0 secctx=system_u:object_r:unlabeled_t:s0 use=1
tcp      6 65 TIME_WAIT src=127.0.0.1 dst=127.0.0.1 sport=42172 dport=6881 src=127.0.0.1 dst=127.0.0.1 sport=6881 dport=42172 [ASSURED] mark=0 secctx=system_u:object_r:unlabeled_t:s0 use=1
tcp      6 65 TIME_WAIT src=127.0.0.1 dst=127.0.0.1 sport=42194 dport=6881 src=127.0.0.1 dst=127.0.0.1 sport=6881 dport=42194 [ASSURED] mark=0 secctx=system_u:object_r:unlabeled_t:s0 use=1
tcp      6 46 CLOSE_WAIT src=10.0.125.114 dst=137.221.106.103 sport=38926 dport=443 src=137.221.106.103 dst=10.0.125.114 sport=443 dport=38926 [ASSURED] mark=0 secctx=system_u:object_r:unlabeled_t:s0 use=1
udp      17 14 src=10.0.125.114 dst=10.0.125.1 sport=34569 dport=53 src=10.0.125.1 dst=10.0.125.114 sport=53 dport=34569 mark=0 secctx=system_u:object_r:unlabeled_t:s0 use=1
udp      17 5 src=10.0.125.114 dst=10.0.125.1 sport=48980 dport=53 src=10.0.125.1 dst=10.0.125.114 sport=53 dport=48980 mark=0 secctx=system_u:object_r:unlabeled_t:s0 use=1
tcp      6 66 TIME_WAIT src=10.0.125.114 dst=24.105.29.76 sport=48318 dport=443 src=24.105.29.76 dst=10.0.125.114 sport=443 dport=48318 [ASSURED] mark=0 secctx=system_u:object_r:unlabeled_t:s0 use=1
udp      17 4 src=10.0.125.114 dst=10.0.125.1 sport=34574 dport=53 src=10.0.125.1 dst=10.0.125.114 sport=53 dport=34574 mark=0 secctx=system_u:object_r:unlabeled_t:s0 use=1
tcp      6 65 TIME_WAIT src=127.0.0.1 dst=127.0.0.1 sport=42184 dport=6881 src=127.0.0.1 dst=127.0.0.1 sport=6881 dport=42184 [ASSURED] mark=0 secctx=system_u:object_r:unlabeled_t:s0 use=1
tcp      6 84 TIME_WAIT src=127.0.0.1 dst=127.0.0.1 sport=59954 dport=6881 src=127.0.0.1 dst=127.0.0.1 sport=6881 dport=59954 [ASSURED] mark=0 secctx=system_u:object_r:unlabeled_t:s0 use=2
tcp      6 64 TIME_WAIT src=127.0.0.1 dst=127.0.0.1 sport=42034 dport=6881 src=127.0.0.1 dst=127.0.0.1 sport=6881 dport=42034 [ASSURED] mark=0 secctx=system_u:object_r:unlabeled_t:s0 use=1
tcp      6 431999 ESTABLISHED src=10.0.125.114 dst=13.226.204.87 sport=33678 dport=443 src=13.226.204.87 dst=10.0.125.114 sport=443 dport=33678 [ASSURED] mark=0 secctx=system_u:object_r:unlabeled_t:s0 use=1
tcp      6 93 TIME_WAIT src=127.0.0.1 dst=127.0.0.1 sport=37232 dport=6881 src=127.0.0.1 dst=127.0.0.1 sport=6881 dport=37232 [ASSURED] mark=0 secctx=system_u:object_r:unlabeled_t:s0 use=1
tcp      6 66 TIME_WAIT src=127.0.0.1 dst=127.0.0.1 sport=42318 dport=6881 src=127.0.0.1 dst=127.0.0.1 sport=6881 dport=42318 [ASSURED] mark=0 secctx=system_u:object_r:unlabeled_t:s0 use=1
tcp      6 431986 ESTABLISHED src=10.0.125.114 dst=137.221.104.172 sport=55716 dport=1119 src=137.221.104.172 dst=10.0.125.114 sport=1119 dport=55716 [ASSURED] mark=0 secctx=system_u:object_r:unlabeled_t:s0 use=1
tcp      6 64 TIME_WAIT src=127.0.0.1 dst=127.0.0.1 sport=42128 dport=6881 src=127.0.0.1 dst=127.0.0.1 sport=6881 dport=42128 [ASSURED] mark=0 secctx=system_u:object_r:unlabeled_t:s0 use=1
tcp      6 64 TIME_WAIT src=127.0.0.1 dst=127.0.0.1 sport=42020 dport=6881 src=127.0.0.1 dst=127.0.0.1 sport=6881 dport=42020 [ASSURED] mark=0 secctx=system_u:object_r:unlabeled_t:s0 use=1
tcp      6 96 TIME_WAIT src=127.0.0.1 dst=127.0.0.1 sport=37242 dport=6881 src=127.0.0.1 dst=127.0.0.1 sport=6881 dport=37242 [ASSURED] mark=0 secctx=system_u:object_r:unlabeled_t:s0 use=1
tcp      6 72 TIME_WAIT src=127.0.0.1 dst=127.0.0.1 sport=60520 dport=6881 src=127.0.0.1 dst=127.0.0.1 sport=6881 dport=60520 [ASSURED] mark=0 secctx=system_u:object_r:unlabeled_t:s0 use=1
tcp      6 65 TIME_WAIT src=10.0.125.114 dst=137.221.106.19 sport=36322 dport=1119 src=137.221.106.19 dst=10.0.125.114 sport=1119 dport=36322 [ASSURED] mark=0 secctx=system_u:object_r:unlabeled_t:s0 use=1
tcp      6 44 CLOSE_WAIT src=10.0.125.114 dst=137.221.106.103 sport=49148 dport=80 src=137.221.106.103 dst=10.0.125.114 sport=80 dport=49148 [ASSURED] mark=0 secctx=system_u:object_r:unlabeled_t:s0 use=1
tcp      6 75 TIME_WAIT src=127.0.0.1 dst=127.0.0.1 sport=60532 dport=6881 src=127.0.0.1 dst=127.0.0.1 sport=6881 dport=60532 [ASSURED] mark=0 secctx=system_u:object_r:unlabeled_t:s0 use=1
tcp      6 63 TIME_WAIT src=127.0.0.1 dst=127.0.0.1 sport=41994 dport=6881 src=127.0.0.1 dst=127.0.0.1 sport=6881 dport=41994 [ASSURED] mark=0 secctx=system_u:object_r:unlabeled_t:s0 use=1
tcp      6 63 TIME_WAIT src=10.0.125.114 dst=137.221.106.22 sport=47194 dport=1119 src=137.221.106.22 dst=10.0.125.114 sport=1119 dport=47194 [ASSURED] mark=0 secctx=system_u:object_r:unlabeled_t:s0 use=1
tcp      6 63 TIME_WAIT src=127.0.0.1 dst=127.0.0.1 sport=41938 dport=6881 src=127.0.0.1 dst=127.0.0.1 sport=6881 dport=41938 [ASSURED] mark=0 secctx=system_u:object_r:unlabeled_t:s0 use=1
tcp      6 87 TIME_WAIT src=10.0.125.114 dst=104.117.244.10 sport=41430 dport=443 src=104.117.244.10 dst=10.0.125.114 sport=443 dport=41430 [ASSURED] mark=0 secctx=system_u:object_r:unlabeled_t:s0 use=1
tcp      6 64 TIME_WAIT src=127.0.0.1 dst=127.0.0.1 sport=42118 dport=6881 src=127.0.0.1 dst=127.0.0.1 sport=6881 dport=42118 [ASSURED] mark=0 secctx=system_u:object_r:unlabeled_t:s0 use=1
tcp      6 64 TIME_WAIT src=127.0.0.1 dst=127.0.0.1 sport=42160 dport=6881 src=127.0.0.1 dst=127.0.0.1 sport=6881 dport=42160 [ASSURED] mark=0 secctx=system_u:object_r:unlabeled_t:s0 use=1
tcp      6 431976 ESTABLISHED src=127.0.0.1 dst=127.0.0.1 sport=52292 dport=45741 src=127.0.0.1 dst=127.0.0.1 sport=45741 dport=52292 [ASSURED] mark=0 secctx=system_u:object_r:unlabeled_t:s0 use=1
tcp      6 108 TIME_WAIT src=127.0.0.1 dst=127.0.0.1 sport=38506 dport=6881 src=127.0.0.1 dst=127.0.0.1 sport=6881 dport=38506 [ASSURED] mark=0 secctx=system_u:object_r:unlabeled_t:s0 use=1
tcp      6 431976 ESTABLISHED src=127.0.0.1 dst=127.0.0.1 sport=44564 dport=44367 src=127.0.0.1 dst=127.0.0.1 sport=44367 dport=44564 [ASSURED] mark=0 secctx=system_u:object_r:unlabeled_t:s0 use=1
tcp      6 66 TIME_WAIT src=127.0.0.1 dst=127.0.0.1 sport=42322 dport=6881 src=127.0.0.1 dst=127.0.0.1 sport=6881 dport=42322 [ASSURED] mark=0 secctx=system_u:object_r:unlabeled_t:s0 use=1
tcp      6 64 TIME_WAIT src=10.0.125.114 dst=137.221.106.19 sport=36274 dport=1119 src=137.221.106.19 dst=10.0.125.114 sport=1119 dport=36274 [ASSURED] mark=0 secctx=system_u:object_r:unlabeled_t:s0 use=1
tcp      6 94 TIME_WAIT src=10.0.125.114 dst=209.132.190.2 sport=33738 dport=80 src=209.132.190.2 dst=10.0.125.114 sport=80 dport=33738 [ASSURED] mark=0 secctx=system_u:object_r:unlabeled_t:s0 use=1
tcp      6 64 TIME_WAIT src=127.0.0.1 dst=127.0.0.1 sport=42032 dport=6881 src=127.0.0.1 dst=127.0.0.1 sport=6881 dport=42032 [ASSURED] mark=0 secctx=system_u:object_r:unlabeled_t:s0 use=1
tcp      6 63 TIME_WAIT src=127.0.0.1 dst=127.0.0.1 sport=41960 dport=6881 src=127.0.0.1 dst=127.0.0.1 sport=6881 dport=41960 [ASSURED] mark=0 secctx=system_u:object_r:unlabeled_t:s0 use=1
tcp      6 431985 ESTABLISHED src=127.0.0.1 dst=127.0.0.1 sport=58694 dport=39269 src=127.0.0.1 dst=127.0.0.1 sport=39269 dport=58694 [ASSURED] mark=0 secctx=system_u:object_r:unlabeled_t:s0 use=1
tcp      6 106 TIME_WAIT src=127.0.0.1 dst=127.0.0.1 sport=54786 dport=6881 src=127.0.0.1 dst=127.0.0.1 sport=6881 dport=54786 [ASSURED] mark=0 secctx=system_u:object_r:unlabeled_t:s0 use=1
tcp      6 431976 ESTABLISHED src=10.0.125.114 dst=24.105.29.76 sport=48340 dport=443 src=24.105.29.76 dst=10.0.125.114 sport=443 dport=48340 [ASSURED] mark=0 secctx=system_u:object_r:unlabeled_t:s0 use=1
tcp      6 64 TIME_WAIT src=127.0.0.1 dst=127.0.0.1 sport=42162 dport=6881 src=127.0.0.1 dst=127.0.0.1 sport=6881 dport=42162 [ASSURED] mark=0 secctx=system_u:object_r:unlabeled_t:s0 use=1
tcp      6 81 TIME_WAIT src=127.0.0.1 dst=127.0.0.1 sport=59948 dport=6881 src=127.0.0.1 dst=127.0.0.1 sport=6881 dport=59948 [ASSURED] mark=0 secctx=system_u:object_r:unlabeled_t:s0 use=1
tcp      6 69 TIME_WAIT src=127.0.0.1 dst=127.0.0.1 sport=60508 dport=6881 src=127.0.0.1 dst=127.0.0.1 sport=6881 dport=60508 [ASSURED] mark=0 secctx=system_u:object_r:unlabeled_t:s0 use=2
tcp      6 64 TIME_WAIT src=127.0.0.1 dst=127.0.0.1 sport=42028 dport=6881 src=127.0.0.1 dst=127.0.0.1 sport=6881 dport=42028 [ASSURED] mark=0 secctx=system_u:object_r:unlabeled_t:s0 use=1
tcp      6 87 TIME_WAIT src=127.0.0.1 dst=127.0.0.1 sport=59956 dport=6881 src=127.0.0.1 dst=127.0.0.1 sport=6881 dport=59956 [ASSURED] mark=0 secctx=system_u:object_r:unlabeled_t:s0 use=1
tcp      6 63 TIME_WAIT src=10.0.125.114 dst=24.105.29.76 sport=48256 dport=443 src=24.105.29.76 dst=10.0.125.114 sport=443 dport=48256 [ASSURED] mark=0 secctx=system_u:object_r:unlabeled_t:s0 use=1
tcp      6 3 CLOSE_WAIT src=10.0.125.114 dst=137.221.106.22 sport=47178 dport=1119 src=137.221.106.22 dst=10.0.125.114 sport=1119 dport=47178 [ASSURED] mark=0 secctx=system_u:object_r:unlabeled_t:s0 use=1
tcp      6 106 TIME_WAIT src=127.0.0.1 dst=127.0.0.1 sport=54796 dport=6881 src=127.0.0.1 dst=127.0.0.1 sport=6881 dport=54796 [ASSURED] mark=0 secctx=system_u:object_r:unlabeled_t:s0 use=1
tcp      6 64 TIME_WAIT src=127.0.0.1 dst=127.0.0.1 sport=42052 dport=6881 src=127.0.0.1 dst=127.0.0.1 sport=6881 dport=42052 [ASSURED] mark=0 secctx=system_u:object_r:unlabeled_t:s0 use=1
tcp      6 63 TIME_WAIT src=10.0.125.114 dst=137.221.106.22 sport=47182 dport=1119 src=137.221.106.22 dst=10.0.125.114 sport=1119 dport=47182 [ASSURED] mark=0 secctx=system_u:object_r:unlabeled_t:s0 use=1
tcp      6 64 TIME_WAIT src=127.0.0.1 dst=127.0.0.1 sport=42144 dport=6881 src=127.0.0.1 dst=127.0.0.1 sport=6881 dport=42144 [ASSURED] mark=0 secctx=system_u:object_r:unlabeled_t:s0 use=1
tcp      6 64 TIME_WAIT src=10.0.125.114 dst=137.221.106.22 sport=47256 dport=1119 src=137.221.106.22 dst=10.0.125.114 sport=1119 dport=47256 [ASSURED] mark=0 secctx=system_u:object_r:unlabeled_t:s0 use=1
tcp      6 65 TIME_WAIT src=127.0.0.1 dst=127.0.0.1 sport=42174 dport=6881 src=127.0.0.1 dst=127.0.0.1 sport=6881 dport=42174 [ASSURED] mark=0 secctx=system_u:object_r:unlabeled_t:s0 use=1
tcp      6 90 TIME_WAIT src=127.0.0.1 dst=127.0.0.1 sport=37228 dport=6881 src=127.0.0.1 dst=127.0.0.1 sport=6881 dport=37228 [ASSURED] mark=0 secctx=system_u:object_r:unlabeled_t:s0 use=1
tcp      6 96 TIME_WAIT src=127.0.0.1 dst=127.0.0.1 sport=37246 dport=6881 src=127.0.0.1 dst=127.0.0.1 sport=6881 dport=37246 [ASSURED] mark=0 secctx=system_u:object_r:unlabeled_t:s0 use=1
tcp      6 67 TIME_WAIT src=10.0.125.114 dst=8.253.112.108 sport=37528 dport=80 src=8.253.112.108 dst=10.0.125.114 sport=80 dport=37528 [ASSURED] mark=0 secctx=system_u:object_r:unlabeled_t:s0 use=1
tcp      6 63 TIME_WAIT src=127.0.0.1 dst=127.0.0.1 sport=41972 dport=6881 src=127.0.0.1 dst=127.0.0.1 sport=6881 dport=41972 [ASSURED] mark=0 secctx=system_u:object_r:unlabeled_t:s0 use=1
tcp      6 431975 ESTABLISHED src=10.0.125.114 dst=24.105.29.76 sport=48332 dport=443 src=24.105.29.76 dst=10.0.125.114 sport=443 dport=48332 [ASSURED] mark=0 secctx=system_u:object_r:unlabeled_t:s0 use=1
tcp      6 65 TIME_WAIT src=10.0.125.114 dst=137.221.106.19 sport=36302 dport=1119 src=137.221.106.19 dst=10.0.125.114 sport=1119 dport=36302 [ASSURED] mark=0 secctx=system_u:object_r:unlabeled_t:s0 use=1
tcp      6 65 TIME_WAIT src=10.0.125.114 dst=137.221.106.19 sport=36312 dport=1119 src=137.221.106.19 dst=10.0.125.114 sport=1119 dport=36312 [ASSURED] mark=0 secctx=system_u:object_r:unlabeled_t:s0 use=1
udp      17 6 src=10.0.125.114 dst=10.0.125.1 sport=36538 dport=53 src=10.0.125.1 dst=10.0.125.114 sport=53 dport=36538 mark=0 secctx=system_u:object_r:unlabeled_t:s0 use=1
tcp      6 64 TIME_WAIT src=127.0.0.1 dst=127.0.0.1 sport=42046 dport=6881 src=127.0.0.1 dst=127.0.0.1 sport=6881 dport=42046 [ASSURED] mark=0 secctx=system_u:object_r:unlabeled_t:s0 use=1
tcp      6 63 TIME_WAIT src=10.0.125.114 dst=137.221.106.22 sport=47212 dport=1119 src=137.221.106.22 dst=10.0.125.114 sport=1119 dport=47212 [ASSURED] mark=0 secctx=system_u:object_r:unlabeled_t:s0 use=1
tcp      6 63 TIME_WAIT src=10.0.125.114 dst=137.221.106.22 sport=47228 dport=1119 src=137.221.106.22 dst=10.0.125.114 sport=1119 dport=47228 [ASSURED] mark=0 secctx=system_u:object_r:unlabeled_t:s0 use=1
tcp      6 64 TIME_WAIT src=10.0.125.114 dst=137.221.106.19 sport=36284 dport=1119 src=137.221.106.19 dst=10.0.125.114 sport=1119 dport=36284 [ASSURED] mark=0 secctx=system_u:object_r:unlabeled_t:s0 use=1
tcp      6 64 TIME_WAIT src=10.0.125.114 dst=137.221.106.22 sport=47270 dport=1119 src=137.221.106.22 dst=10.0.125.114 sport=1119 dport=47270 [ASSURED] mark=0 secctx=system_u:object_r:unlabeled_t:s0 use=1
tcp      6 431952 ESTABLISHED src=10.0.125.114 dst=24.105.29.76 sport=48356 dport=443 src=24.105.29.76 dst=10.0.125.114 sport=443 dport=48356 [ASSURED] mark=0 secctx=system_u:object_r:unlabeled_t:s0 use=1
tcp      6 64 TIME_WAIT src=127.0.0.1 dst=127.0.0.1 sport=42104 dport=6881 src=127.0.0.1 dst=127.0.0.1 sport=6881 dport=42104 [ASSURED] mark=0 secctx=system_u:object_r:unlabeled_t:s0 use=1
tcp      6 63 TIME_WAIT src=127.0.0.1 dst=127.0.0.1 sport=41954 dport=6881 src=127.0.0.1 dst=127.0.0.1 sport=6881 dport=41954 [ASSURED] mark=0 secctx=system_u:object_r:unlabeled_t:s0 use=1
tcp      6 65 TIME_WAIT src=127.0.0.1 dst=127.0.0.1 sport=42210 dport=6881 src=127.0.0.1 dst=127.0.0.1 sport=6881 dport=42210 [ASSURED] mark=0 secctx=system_u:object_r:unlabeled_t:s0 use=1
udp      17 5 src=10.0.125.114 dst=10.0.125.1 sport=45535 dport=53 src=10.0.125.1 dst=10.0.125.114 sport=53 dport=45535 mark=0 secctx=system_u:object_r:unlabeled_t:s0 use=1
tcp      6 63 TIME_WAIT src=10.0.125.114 dst=137.221.106.19 sport=36256 dport=1119 src=137.221.106.19 dst=10.0.125.114 sport=1119 dport=36256 [ASSURED] mark=0 secctx=system_u:object_r:unlabeled_t:s0 use=1
tcp      6 78 TIME_WAIT src=127.0.0.1 dst=127.0.0.1 sport=59946 dport=6881 src=127.0.0.1 dst=127.0.0.1 sport=6881 dport=59946 [ASSURED] mark=0 secctx=system_u:object_r:unlabeled_t:s0 use=1
tcp      6 64 TIME_WAIT src=127.0.0.1 dst=127.0.0.1 sport=42132 dport=6881 src=127.0.0.1 dst=127.0.0.1 sport=6881 dport=42132 [ASSURED] mark=0 secctx=system_u:object_r:unlabeled_t:s0 use=1
tcp      6 106 TIME_WAIT src=10.0.125.114 dst=137.221.106.121 sport=56450 dport=443 src=137.221.106.121 dst=10.0.125.114 sport=443 dport=56450 [ASSURED] mark=0 secctx=system_u:object_r:unlabeled_t:s0 use=2
tcp      6 65 TIME_WAIT src=127.0.0.1 dst=127.0.0.1 sport=42272 dport=6881 src=127.0.0.1 dst=127.0.0.1 sport=6881 dport=42272 [ASSURED] mark=0 secctx=system_u:object_r:unlabeled_t:s0 use=1
tcp      6 431984 ESTABLISHED src=127.0.0.1 dst=127.0.0.1 sport=54756 dport=6881 src=127.0.0.1 dst=127.0.0.1 sport=6881 dport=54756 [ASSURED] mark=0 secctx=system_u:object_r:unlabeled_t:s0 use=1
tcp      6 63 TIME_WAIT src=127.0.0.1 dst=127.0.0.1 sport=41924 dport=6881 src=127.0.0.1 dst=127.0.0.1 sport=6881 dport=41924 [ASSURED] mark=0 secctx=system_u:object_r:unlabeled_t:s0 use=1
tcp      6 66 TIME_WAIT src=10.0.125.114 dst=8.253.112.108 sport=37538 dport=80 src=8.253.112.108 dst=10.0.125.114 sport=80 dport=37538 [ASSURED] mark=0 secctx=system_u:object_r:unlabeled_t:s0 use=1
tcp      6 65 TIME_WAIT src=127.0.0.1 dst=127.0.0.1 sport=42262 dport=6881 src=127.0.0.1 dst=127.0.0.1 sport=6881 dport=42262 [ASSURED] mark=0 secctx=system_u:object_r:unlabeled_t:s0 use=1
tcp      6 114 TIME_WAIT src=127.0.0.1 dst=127.0.0.1 sport=38530 dport=6881 src=127.0.0.1 dst=127.0.0.1 sport=6881 dport=38530 [ASSURED] mark=0 secctx=system_u:object_r:unlabeled_t:s0 use=1
tcp      6 431976 ESTABLISHED src=127.0.0.1 dst=127.0.0.1 sport=45174 dport=37703 src=127.0.0.1 dst=127.0.0.1 sport=37703 dport=45174 [ASSURED] mark=0 secctx=system_u:object_r:unlabeled_t:s0 use=1
tcp      6 102 TIME_WAIT src=127.0.0.1 dst=127.0.0.1 sport=54752 dport=6881 src=127.0.0.1 dst=127.0.0.1 sport=6881 dport=54752 [ASSURED] mark=0 secctx=system_u:object_r:unlabeled_t:s0 use=1
tcp      6 99 TIME_WAIT src=127.0.0.1 dst=127.0.0.1 sport=54736 dport=6881 src=127.0.0.1 dst=127.0.0.1 sport=6881 dport=54736 [ASSURED] mark=0 secctx=system_u:object_r:unlabeled_t:s0 use=1
tcp      6 117 TIME_WAIT src=127.0.0.1 dst=127.0.0.1 sport=38542 dport=6881 src=127.0.0.1 dst=127.0.0.1 sport=6881 dport=38542 [ASSURED] mark=0 secctx=system_u:object_r:unlabeled_t:s0 use=1
udp      17 6 src=10.0.125.114 dst=10.0.125.1 sport=42820 dport=53 src=10.0.125.1 dst=10.0.125.114 sport=53 dport=42820 mark=0 secctx=system_u:object_r:unlabeled_t:s0 use=1
tcp      6 431953 ESTABLISHED src=10.0.125.114 dst=137.221.106.121 sport=49320 dport=443 src=137.221.106.121 dst=10.0.125.114 sport=443 dport=49320 [ASSURED] mark=0 secctx=system_u:object_r:unlabeled_t:s0 use=1
tcp      6 66 TIME_WAIT src=10.0.125.114 dst=24.105.29.76 sport=48300 dport=443 src=24.105.29.76 dst=10.0.125.114 sport=443 dport=48300 [ASSURED] mark=0 secctx=system_u:object_r:unlabeled_t:s0 use=1
tcp      6 16 CLOSE_WAIT src=10.0.125.114 dst=137.221.106.102 sport=36006 dport=443 src=137.221.106.102 dst=10.0.125.114 sport=443 dport=36006 [ASSURED] mark=0 secctx=system_u:object_r:unlabeled_t:s0 use=1
udp      17 6 src=10.0.125.114 dst=10.0.125.1 sport=42640 dport=53 src=10.0.125.1 dst=10.0.125.114 sport=53 dport=42640 mark=0 secctx=system_u:object_r:unlabeled_t:s0 use=1
tcp      6 63 TIME_WAIT src=127.0.0.1 dst=127.0.0.1 sport=41980 dport=6881 src=127.0.0.1 dst=127.0.0.1 sport=6881 dport=41980 [ASSURED] mark=0 secctx=system_u:object_r:unlabeled_t:s0 use=1
tcp      6 66 TIME_WAIT src=127.0.0.1 dst=127.0.0.1 sport=42314 dport=6881 src=127.0.0.1 dst=127.0.0.1 sport=6881 dport=42314 [ASSURED] mark=0 secctx=system_u:object_r:unlabeled_t:s0 use=1
tcp      6 66 TIME_WAIT src=10.0.125.114 dst=24.105.29.76 sport=48316 dport=443 src=24.105.29.76 dst=10.0.125.114 sport=443 dport=48316 [ASSURED] mark=0 secctx=system_u:object_r:unlabeled_t:s0 use=1
tcp      6 431986 ESTABLISHED src=10.0.125.114 dst=137.221.104.172 sport=59564 dport=1119 src=137.221.104.172 dst=10.0.125.114 sport=1119 dport=59564 [ASSURED] mark=0 secctx=system_u:object_r:unlabeled_t:s0 use=1
tcp      6 105 TIME_WAIT src=127.0.0.1 dst=127.0.0.1 sport=54774 dport=6881 src=127.0.0.1 dst=127.0.0.1 sport=6881 dport=54774 [ASSURED] mark=0 secctx=system_u:object_r:unlabeled_t:s0 use=1
tcp      6 65 TIME_WAIT src=127.0.0.1 dst=127.0.0.1 sport=42280 dport=6881 src=127.0.0.1 dst=127.0.0.1 sport=6881 dport=42280 [ASSURED] mark=0 secctx=system_u:object_r:unlabeled_t:s0 use=1
tcp      6 106 TIME_WAIT src=127.0.0.1 dst=127.0.0.1 sport=54806 dport=6881 src=127.0.0.1 dst=127.0.0.1 sport=6881 dport=54806 [ASSURED] mark=0 secctx=system_u:object_r:unlabeled_t:s0 use=1
tcp      6 64 TIME_WAIT src=127.0.0.1 dst=127.0.0.1 sport=42066 dport=6881 src=127.0.0.1 dst=127.0.0.1 sport=6881 dport=42066 [ASSURED] mark=0 secctx=system_u:object_r:unlabeled_t:s0 use=1
tcp      6 64 TIME_WAIT src=10.0.125.114 dst=24.105.29.76 sport=48286 dport=443 src=24.105.29.76 dst=10.0.125.114 sport=443 dport=48286 [ASSURED] mark=0 secctx=system_u:object_r:unlabeled_t:s0 use=1
conntrack v1.4.6 (conntrack-tools): 135 flow entries have been shown.
```

**Comment by erig0** [comment]
@cody35367, You need to use `conntrack -f ipv6 -L`. Then `invalid` packets are IPv6.

**Comment by cody35367** [comment]
Oops, makes sense. My bad. Here is the v6 dump in the same 10 seconds after, with no workaround, while trying to connect.

```
$ sudo conntrack -f ipv6 -L
tcp      6 42 SYN_RECV src=::1 dst=::1 sport=35661 dport=35661 src=::1 dst=::1 sport=35661 dport=35661 mark=0 secctx=system_u:object_r:unlabeled_t:s0 use=1
tcp      6 34 SYN_RECV src=::1 dst=::1 sport=40413 dport=40413 src=::1 dst=::1 sport=40413 dport=40413 mark=0 secctx=system_u:object_r:unlabeled_t:s0 use=1
conntrack v1.4.6 (conntrack-tools): 2 flow entries have been shown.
```

**Comment by erig0** [comment]
Those packets have the same source and destination ports. I don't know how that's possible over loopback interface. Perhaps that's why conntrack does not like them.

**Comment by sT331h0rs3** [comment]
The issue still persists with version 1.2.2 of firewalld.

**Comment by cody35367** [comment]
Complete shot in the dark here: Do we know if Wine/Proton does anything special to allow this? This game is all running under Wine with some of the proton patches. Maybe its nothing and just uses the normal Linux network stack, but I have not found any docs on this to say either way.

**Comment by imaspeer** [comment]
I strace'd the client's network calls to try to understand what's going on, and it appears it connects the socket to itself, then passes it to other processes via a unix socket and uses it as a form of IPC.

Here are the relevant trace lines:
```
80019 19:14:16 socket(AF_INET6, SOCK_STREAM, IPPROTO_TCP) = 4047<TCPv6:[2387366]>
80019 19:14:16 setsockopt(4047<TCPv6:[2387366]>, SOL_IPV6, IPV6_DONTFRAG, [1], 4) = 0
80019 19:14:16 setsockopt(4047<TCPv6:[2387366]>, SOL_IPV6, IPV6_V6ONLY, [1], 4) = 0
80019 19:14:16 getsockopt(4047<TCPv6:[2387366]>, SOL_SOCKET, SO_RCVBUF, [131072], [4]) = 0
80019 19:14:16 getsockopt(4047<TCPv6:[2387366]>, SOL_SOCKET, SO_SNDBUF, [16384], [4]) = 0
80019 19:14:16 setsockopt(4047<TCPv6:[2387366]>, SOL_SOCKET, SO_REUSEADDR, [1], 4) = 0
80019 19:14:16 getsockopt(4047<TCPv6:[2387366]>, SOL_IPV6, IPV6_V6ONLY, [1], [4]) = 0
80019 19:14:16 bind(4047<TCPv6:[2387366]>, {sa_family=AF_INET6, sin6_port=htons(0), sin6_flowinfo=htonl(0), inet_pton(AF_INET6, "::1", &sin6_addr), sin6_scope_id=1}, 28) = 0
80019 19:14:16 getsockname(4047<TCPv6:[2387366]>, {sa_family=AF_INET6, sin6_port=htons(42267), sin6_flowinfo=htonl(0), inet_pton(AF_INET6, "::1", &sin6_addr), sin6_scope_id=0}, [28]) = 0
80019 19:14:16 connect(4047<TCPv6:[2387366]>, {sa_family=AF_INET6, sin6_port=htons(42267), sin6_flowinfo=htonl(0), inet_pton(AF_INET6, "::1", &sin6_addr), sin6_scope_id=0}, 28) = -1 EINPROGRESS (Operation now in progress)
80019 19:14:16 getsockname(4047<TCPv6:[[::1]:42267->[::1]:42267]>, {sa_family=AF_INET6, sin6_port=htons(42267), sin6_flowinfo=htonl(0), inet_pton(AF_INET6, "::1", &sin6_addr), sin6_scope_id=0}, [28]) = 0
80019 19:14:16 getsockopt(4047<TCPv6:[[::1]:42267->[::1]:42267]>, SOL_SOCKET, SO_OOBINLINE, [0], [4]) = 0
80019 19:14:16 getsockopt(4047<TCPv6:[[::1]:42267->[::1]:42267]>, SOL_SOCKET, SO_OOBINLINE, [0], [4]) = 0
80019 19:14:16 getsockopt(4047<TCPv6:[[::1]:42267->[::1]:42267]>, SOL_SOCKET, SO_OOBINLINE, [0], [4]) = 0
80019 19:14:16 getsockopt(4047<TCPv6:[[::1]:42267->[::1]:42267]>, SOL_SOCKET, SO_OOBINLINE, [0], [4]) = 0
80019 19:14:16 getsockopt(4047<TCPv6:[[::1]:42267->[::1]:42267]>, SOL_SOCKET, SO_OOBINLINE, [0], [4]) = 0
80019 19:14:16 getsockopt(4047<TCPv6:[[::1]:42267->[::1]:42267]>, SOL_SOCKET, SO_OOBINLINE, [0], [4]) = 0
80019 19:14:16 getsockopt(4047<TCPv6:[[::1]:42267->[::1]:42267]>, SOL_SOCKET, SO_OOBINLINE, [0], [4]) = 0
80019 19:14:16 getsockopt(4047<TCPv6:[[::1]:42267->[::1]:42267]>, SOL_SOCKET, SO_OOBINLINE, [0], [4]) = 0
80019 19:14:16 getsockopt(4047<TCPv6:[[::1]:42267->[::1]:42267]>, SOL_SOCKET, SO_OOBINLINE, [0], [4]) = 0
80019 19:14:17 sendmsg(3967<UNIX-STREAM:[2383760->2383759]>, {msg_name=NULL, msg_namelen=0, msg_iov=[{iov_base="\\\1\0\0", iov_len=4}], msg_iovlen=1, msg_control=[{cmsg_len=20, cmsg_level=SOL_SOCKET, cmsg_type=SCM_RIGHTS, cmsg_data=[4047<TCPv6:[[::1]:42267->[::1]:42267]>]}], msg_controllen=20, msg_flags=0}, 0) = 4
80659 19:14:17 recvmsg(370<UNIX-STREAM:[2383759->2383760]>, {msg_name=NULL, msg_namelen=0, msg_iov=[{iov_base="\\\1\0\0", iov_len=4}], msg_iovlen=1, msg_control=[{cmsg_len=20, cmsg_level=SOL_SOCKET, cmsg_type=SCM_RIGHTS, cmsg_data=[68<TCPv6:[[::1]:42267->[::1]:42267]>]}], msg_controllen=24, msg_flags=MSG_CMSG_CLOEXEC}, MSG_CMSG_CLOEXEC) = 4
80659 19:14:17 getsockopt(68<TCPv6:[[::1]:42267->[::1]:42267]>, SOL_SOCKET, SO_PROTOCOL, [6], [4]) = 0
80659 19:14:17 sendmsg(68<TCPv6:[[::1]:42267->[::1]:42267]>, {msg_name=NULL, msg_namelen=0, msg_iov=[{iov_base="\1", iov_len=1}], msg_iovlen=1, msg_controllen=0, msg_flags=0}, 0 <unfinished ...>
80019 19:14:17 recvfrom(4047<TCPv6:[[::1]:42267->[::1]:42267]>, "\1", 1, MSG_PEEK, NULL, NULL) = 1
80659 19:14:17 getsockopt(68<TCPv6:[[::1]:42267->[::1]:42267]>, SOL_SOCKET, SO_PROTOCOL, [6], [4]) = 0
80659 19:14:17 sendmsg(68<TCPv6:[[::1]:42267->[::1]:42267]>, {msg_name=NULL, msg_namelen=0, msg_iov=[{iov_base="\1", iov_len=1}], msg_iovlen=1, msg_controllen=0, msg_flags=0}, 0) = 1
80019 19:14:17 recvfrom(4047<TCPv6:[[::1]:42267->[::1]:42267]>, "\1", 1, MSG_PEEK, NULL, NULL) = 1
80019 19:14:17 recvfrom(4047<TCPv6:[[::1]:42267->[::1]:42267]>, "\1", 1, MSG_PEEK, NULL, NULL) = 1
80019 19:14:17 recvfrom(4047<TCPv6:[[::1]:42267->[::1]:42267]>, "\1", 1, MSG_PEEK, NULL, NULL) = 1
80019 19:14:17 recvfrom(4047<TCPv6:[[::1]:42267->[::1]:42267]>, "\1", 1, MSG_PEEK, NULL, NULL) = 1
80019 19:14:17 sendmsg(3967<UNIX-STREAM:[2383760->2383759]>, {msg_name=NULL, msg_namelen=0, msg_iov=[{iov_base="P\1\0\0", iov_len=4}], msg_iovlen=1, msg_control=[{cmsg_len=20, cmsg_level=SOL_SOCKET, cmsg_type=SCM_RIGHTS, cmsg_data=[4047<TCPv6:[[::1]:42267->[::1]:42267]>]}], msg_controllen=20, msg_flags=0}, 0) = 4
80661 19:14:17 recvmsg(370<UNIX-STREAM:[2383759->2383760]>, {msg_name=NULL, msg_namelen=0, msg_iov=[{iov_base="P\1\0\0", iov_len=4}], msg_iovlen=1, msg_control=[{cmsg_len=20, cmsg_level=SOL_SOCKET, cmsg_type=SCM_RIGHTS, cmsg_data=[69<TCPv6:[[::1]:42267->[::1]:42267]>]}], msg_controllen=24, msg_flags=MSG_CMSG_CLOEXEC}, MSG_CMSG_CLOEXEC) = 4
80661 19:14:17 getsockopt(69<TCPv6:[[::1]:42267->[::1]:42267]>, SOL_SOCKET, SO_PROTOCOL, [6], [4]) = 0
80661 19:14:17 recvmsg(69<TCPv6:[[::1]:42267->[::1]:42267]>, {msg_name=NULL, msg_namelen=0, msg_iov=[{iov_base="\1\1", iov_len=16}], msg_iovlen=1, msg_controllen=0, msg_flags=0}, 0) = 2
80659 19:14:17 getsockopt(68<TCPv6:[[::1]:42267->[::1]:42267]>, SOL_SOCKET, SO_PROTOCOL, [6], [4]) = 0
80659 19:14:17 sendmsg(68<TCPv6:[[::1]:42267->[::1]:42267]>, {msg_name=NULL, msg_namelen=0, msg_iov=[{iov_base="\1", iov_len=1}], msg_iovlen=1, msg_controllen=0, msg_flags=0}, 0) = 1
80659 19:14:17 getsockopt(68<TCPv6:[[::1]:42267->[::1]:42267]>, SOL_SOCKET, SO_PROTOCOL, [6], [4]) = 0
80659 19:14:17 sendmsg(68<TCPv6:[[::1]:42267->[::1]:42267]>, {msg_name=NULL, msg_namelen=0, msg_iov=[{iov_base="\1", iov_len=1}], msg_iovlen=1, msg_controllen=0, msg_flags=0}, 0) = 1
80019 19:14:17 recvfrom(4047<TCPv6:[[::1]:42267->[::1]:42267]>,  <unfinished ...>
80019 19:14:17 recvfrom(4047<TCPv6:[[::1]:42267->[::1]:42267]>, "\1", 1, MSG_PEEK, NULL, NULL) = 1
80019 19:14:17 recvfrom(4047<TCPv6:[[::1]:42267->[::1]:42267]>, "\1", 1, MSG_PEEK, NULL, NULL) = 1
80019 19:14:17 recvfrom(4047<TCPv6:[[::1]:42267->[::1]:42267]>, "\1", 1, MSG_PEEK, NULL, NULL) = 1
80019 19:14:17 recvfrom(4047<TCPv6:[[::1]:42267->[::1]:42267]>, "\1", 1, MSG_PEEK, NULL, NULL) = 1
80661 19:14:17 getsockopt(69<TCPv6:[[::1]:42267->[::1]:42267]>, SOL_SOCKET, SO_PROTOCOL, [6], [4]) = 0
80661 19:14:17 recvmsg(69<TCPv6:[[::1]:42267->[::1]:42267]>, {msg_name=NULL, msg_namelen=0, msg_iov=[{iov_base="\1\1", iov_len=16}], msg_iovlen=1, msg_controllen=0, msg_flags=0}, 0) = 2
```

Why it does this instead of just using the unix socket itself is beyond me though...

I can reproduce the STATE_INVALID_DROP error with the following minimal code - although I do receive the message on the socket, but I'm guessing that's because it's the same process:
```C
#include <stdlib.h>
#include <stdio.h>
#include <sys/types.h>
#include <sys/socket.h>
#include <arpa/inet.h>

int main(int argc, char **argv) {
	int sock = socket(AF_INET6, SOCK_STREAM, IPPROTO_TCP);

	struct sockaddr_in6 saddr;
	saddr.sin6_family = AF_INET6;
	inet_pton(AF_INET6, "::1", &saddr.sin6_addr);
	saddr.sin6_port = 0;
	saddr.sin6_flowinfo = 0;
	saddr.sin6_scope_id = 1;
	int sz = sizeof(saddr);

	bind(sock, (struct sockaddr *)&saddr, sz);
	getsockname(sock, (struct sockaddr *)&saddr, &sz);
	connect(sock, (struct sockaddr *)&saddr, sz);

	send(sock, "seriously who tf does this?", 28, 0);

	char *b = malloc(28);
	recv(sock, b, 28, 0);
	printf("recvd: %s\n", b);
	free(b);

	return 0;
}
```

**Comment by erig0** [comment]
Thanks for figuring out what the proxy is doing. I cannot guess why it's doing this.

So options are:

1. Don't fix.
  - The proxy is doing something weird for an unknown reason.

2. Move the `iifname lo accept` to occur before the `ct state invalid drop` check.
  - It's _probably_ okay to always accept traffic over the loopback.

#2 is okay in my opinion. I'm not aware of any reason to not always accept `lo` traffic.

**Comment by imaspeer** [comment]
Wouldn't it be better to fix the underlying issue of treating the packets as invalid? (they're not, it's just a special case of simultaneous open)

**Comment by erig0** [comment]
> Wouldn't it be better to fix the underlying issue of treating the packets as invalid? (they're not, it's just a special case of simultaneous open)

Maybe. I'm not sure if this is fixable (or worth fixing) in conntrack.

In the short term, I don't think there is any harm in unconditionally allowing `lo` traffic.

**Comment by erig0** [comment]
> > Wouldn't it be better to fix the underlying issue of treating the packets as invalid? (they're not, it's just a special case of simultaneous open)
> 
> Maybe. I'm not sure if this is fixable (or worth fixing) in conntrack.
> 
> In the short term, I don't think there is any harm in unconditionally allowing `lo` traffic.

I'm going to merge #1064. If this gets addressed in conntrack, then we can revert #1064. But it would take time for the kernel change to propagate to distributions.
