### ISSUE TITLE
SLES15 Default Iptable rule causing issue

### ISSUE THREAD

**Issue by vissneha** [firewalld/firewalld#716]
Below rule in iptables is causing the slptool to fail in detecting the services of other
hosts.
REJECT all -- anywhere anywhere reject-with icmp-host-prohibited
I deleted it by using below command
iptables -D INPUT -j REJECT --reject-with icmp-host-prohibited
and slp started to discover from other node with firewall enabled.
however when i reload the firewalld or reboot it again went back to original rule
(REJECT)
how can i delete this rule permanently so that even after reoading firewalld daemon it
does not go back to default.
or is there anyother way
![image (1)](https://user-images.githubusercontent.com/66257612/99642013-034d4a00-2a71-11eb-99f1-2b1393351b9f.png)

**Comment by erig0** [comment]
> Below rule in iptables is causing the slptool to fail in detecting the services of other
> hosts.
> REJECT all -- anywhere anywhere reject-with icmp-host-prohibited
> I deleted it by using below command
> iptables -D INPUT -j REJECT --reject-with icmp-host-prohibited
> and slp started to discover from other node with firewall enabled.
> however when i reload the firewalld or reboot it again went back to original rule
> (REJECT)
> how can i delete this rule permanently so that even after reoading firewalld daemon it
> does not go back to default.
> or is there anyother way

As was explained via the mailing list... this rule is _vital_ to firewalld's functionality. Without it firewalld allows all traffic in many configurations. Removing the rule is simply not viable.

You should be adding the `slp` service to the correct zone instead:
```
# firewall-cmd --permanent --zone <zone> --add-service slp
```

**Comment by vissneha** [comment]
> > Below rule in iptables is causing the slptool to fail in detecting the services of other
> > hosts.
> > REJECT all -- anywhere anywhere reject-with icmp-host-prohibited
> > I deleted it by using below command
> > iptables -D INPUT -j REJECT --reject-with icmp-host-prohibited
> > and slp started to discover from other node with firewall enabled.
> > however when i reload the firewalld or reboot it again went back to original rule
> > (REJECT)
> > how can i delete this rule permanently so that even after reoading firewalld daemon it
> > does not go back to default.
> > or is there anyother way
> 
> As was explained via the mailing list... this rule is _vital_ to firewalld's functionality. Without it firewalld allows all traffic in many configurations. That's why removing the rule "works" - firewalld is _not_ filtering packets. Removing the rule is simply not viable.
> 
> You should be adding the `slp` service to the correct zone instead:
> 
> ```
> # firewall-cmd --permanent --zone <zone> --add-service slp
> ```

Even after the adding the slp service , not working

**Comment by erig0** [comment]
Are you sure your SLP server and client are using the `slp` firewalld service uses? `427/tcp` and `427/udp`

**Comment by vissneha** [comment]
> Are you sure your SLP server and client are using the same ports, `427/tcp` and `427/udp`, that the `slp` firewalld service defines?

![image (1)](https://user-images.githubusercontent.com/66257612/99705948-674b2f00-2ac0-11eb-93f7-d27f550c5ab4.png)
yes the slp service is added and port a427/tcp 427/udp both added .. PFA snip

**Comment by erig0** [comment]
> > Are you sure your SLP server and client are using the same ports, `427/tcp` and `427/udp`, that the `slp` firewalld service defines?
> yes the slp service is added and port a427/tcp 427/udp both added .. PFA snip

Can you verify the _server_ and the _client_ are using those ports. I know firewalld is expecting those standard ports to be used, but that doesn't mean your _server_ and _client_ implementations are using the standard ports.

**Comment by erig0** [comment]
You can also enable `--set-log-denied all` to see information about the dropped packets. Check in `dmesg`.

**Comment by vissneha** [comment]
![image (2)](https://user-images.githubusercontent.com/66257612/99766630-7a451a00-2b27-11eb-98ed-ed46b19049b1.png)


> You can also enable `--set-log-denied all` to see information about the dropped packets. Check in `dmesg`.

![image (2)](https://user-images.githubusercontent.com/66257612/99766656-84ffaf00-2b27-11eb-843d-a9c935daf2fd.png)

**Comment by erig0** [comment]
None of the packets in your screenshots are SLP. I see DNS, NETBIOS, and something else on UDP port 8082.

**Comment by vissneha** [comment]
> None of the packets in your screenshots are SLP. I see DNS, NETBIOS, and something else on UDP port 8082.


Tcpdump output:
21:19:50.268917 IP 147.178.42.18.ssh > 147.178.36.252.59879: Flags [P.], seq 2833228903:2833229027, ack 1498828847, win 272, length 124
21:19:50.320524 IP 147.178.36.252.59879 > 147.178.42.18.ssh: Flags [.], ack 124, win 1021, length 0
21:19:50.376533 IP 147.178.42.17.39027 > 147.178.42.18.netsupport: UDP, length 87
21:19:50.758533 IP 147.178.42.17.39027 > 147.178.42.18.netsupport: UDP, length 87
21:19:50.758620 IP 147.178.42.18 > 147.178.42.17: ICMP host 147.178.42.18 unreachable - admin prohibited, length 123

**Comment by erig0** [comment]
>  21:19:50.758620 IP 147.178.42.18 > 147.178.42.17: ICMP host 147.178.42.18 unreachable - admin prohibited, length 123

Again, none of these look like SLP.

**Comment by vissneha** [comment]
> > 21:19:50.758620 IP 147.178.42.18 > 147.178.42.17: ICMP host 147.178.42.18 unreachable - admin prohibited, length 123
> 
> Again, none of these look like SLP.

Is there a way as i said before to remove the rule permanently, without the firewalld stop.
iptables -D INPUT -j REJECT --reject-with icmp-host-prohibited
