### ISSUE TITLE
need to send "unreachable - admin prohibited filter" for trafic from dmz

### ISSUE THREAD

**Issue by sergey-safarov** [firewalld/firewalld#1204]
### What happened

I just installed fresh `firewalld` and assigned interfaces to zones (`public`, `dmz`, `trust`).

Server from the `dmz` trying to reach the host in the Internet.
`firewalld` block this traffic but different ways for IPv4 and IPv6 protocols.

For IPv4 traffic generated ICMP "unreachable - admin prohibited".
```
[root@i-0b1ee00e0d87816e4 zones]# tcpdump -ni any host 100.74.48.156
tcpdump: data link type LINUX_SLL2
dropped privs to tcpdump
tcpdump: verbose output suppressed, use -v[v]... for full protocol decode
listening on any, link-type LINUX_SLL2 (Linux cooked v2), snapshot length 262144 bytes
12:42:14.248285 eth1  In  IP 100.74.48.156.37498 > 152.19.134.198.https: Flags [S], seq 1439351378, win 64240, options [mss 1460,sackOK,TS val 1449058994 ecr 0,nop,wscale 7], length 0
12:42:14.248355 eth0  Out IP 100.74.48.4 > 100.74.48.156: ICMP host 152.19.134.198 unreachable - admin prohibited filter, length 68
12:42:14.750096 eth1  In  IP 100.74.48.156.41036 > 34.221.3.152.https: Flags [S], seq 308107951, win 64240, options [mss 1460,sackOK,TS val 3887439803 ecr 0,nop,wscale 7], length 0
12:42:14.750166 eth0  Out IP 100.74.48.4 > 100.74.48.156: ICMP host 34.221.3.152 unreachable - admin prohibited filter, length 68
```

But for IPv6 packets simply dropped.
```
[root@i-0b1ee00e0d87816e4 zones]# tcpdump -ni any host 2600:1f1c:910:9106:7283:74ad:e8b8:24fe
tcpdump: data link type LINUX_SLL2
dropped privs to tcpdump
tcpdump: verbose output suppressed, use -v[v]... for full protocol decode
listening on any, link-type LINUX_SLL2 (Linux cooked v2), snapshot length 262144 bytes


12:43:41.582643 eth1  In  IP6 2600:1f1c:910:9106:7283:74ad:e8b8:24fe.49166 > 2600:1f14:fad:5c02:7c8a:72d0:1c58:c189.https: Flags [S], seq 3078577311, win 64800, options [mss 1440,sackOK,TS val 1829388007 ecr 0,nop,wscale 7], length 0
12:43:42.618399 eth1  In  IP6 2600:1f1c:910:9106:7283:74ad:e8b8:24fe.49166 > 2600:1f14:fad:5c02:7c8a:72d0:1c58:c189.https: Flags [S], seq 3078577311, win 64800, options [mss 1440,sackOK,TS val 1829389043 ecr 0,nop,wscale 7], length 0
12:43:44.666381 eth1  In  IP6 2600:1f1c:910:9106:7283:74ad:e8b8:24fe.49166 > 2600:1f14:fad:5c02:7c8a:72d0:1c58:c189.https: Flags [S], seq 3078577311, win 64800, options [mss 1440,sackOK,TS val 1829391091 ecr 0,nop,wscale 7], length 0
```

### What you expected to happen

From my perspective for IPv6 packets goes from `dmz` zone we should also send ICMP6 message.

### How to reproduce it (as minimally and precisely as possible)

1. Make a fresh `firewalld` install and then place any server to `dmz` zone.
2. Send and trafic from the `dmz` zone toward the Internet.

### Firewalld Version

1.3.1

### Firewalld Backend

nftables

### Linux distribution

Fedora Linux 38 (Cloud Edition)

### Linux kernel version

6.4.12-200.fc38.aarch64

**Comment by sergey-safarov** [comment]
probable I have misconfigured firewalld.
I will retest and required reopen ticket.
